ID,category,description
0,DIVORCE,Prince William Marriage: New Biography Claims Prince Doubted Marriage To Kate Middleton
1,WELLNESS,WATCH: Exclusive Becoming Fearless Video Series
2,WELLNESS,15 Things You Should Give Up To Be Happy
3,WELLNESS,"Lana Kuykendall\, Mom With Flesh-Eating Disease\, Remains Critical"
4,TRAVEL,Airbus A320 To Offer Extra-Wide Seats For American Airline Companies
5,MONEY,Jim Nichols Made $138 On Facebook Shares
6,PARENTING,Lullabies by Broadway's Best
7,DIVORCE,Cat Divorce: Israeli Man Divorces Wife Over Her 550 Cats
8,WELLNESS,"Dopamine Beta Hydroxylase Deficiency\, Rare Disorder\, Causes Severe Head Rushes"
9,DIVORCE,7 Ways Single Moms Cope With Loneliness
10,PARENTING,Why Being a Mom is the Coolest Job Ever
11,WEDDINGS,Wedding Speeches: 5 Awkward On-Screen Wedding Toasts (VIDEO)
12,WELLNESS,How Eating Probiotic-Rich Can Protect You From Heart Disease
13,STYLE & BEAUTY,L'Uomo Vogue and Africa
14,WELLNESS,"10 Things We Learned from Fat\, Sick and Nearly Dead"
15,MONEY,Five Myths About Prepaid Cards
16,WELLNESS,What Excuses Might We Be Using to Keep Ourselves From Crossing Our Own Finish Lines?
17,FOOD & DRINK,The Best American Cheese For Melting
18,WELLNESS,Why Caregivers Need Self-Compassion
19,PARENTING,How a Friend Saved Lives After the Death of Her Baby -- What Every Mom Should Know
20,DIVORCE,Must Divorced Fathers Become Second Class Citizens?
21,WELLNESS,Let's Revolutionize Prostate Cancer
22,DIVORCE,11 Things All Good Divorce Lawyers Need To Know
23,PARENTING,Who Are The 'Real' Parents? An Adoptive Dad's Answer
24,WELLNESS,Germy Office Surfaces: Study Reveals Most Contaminated Items At Work
25,WELLNESS,Tapping Away Trauma:  'Emotional Freedom' Techniques
26,TRAVEL,Ancient Azerbaijan Dolls Itself Up For The Eurovision Song Contest (PHOTOS)
27,HOME & LIVING,14 Strange Craigslist Ads Of The Week (PHOTOS)
28,MONEY,Websites Help Consumers To Shop Around For Best Healthcare Deals
29,STYLE & BEAUTY,8 Natural Beauty Treatments That Are In Your Kitchen Right Now
30,STYLE & BEAUTY,"Heidi Klum Pole Dances\, Smokes In New Video For Hunger Magazine (VIDEO)"
31,TRAVEL,Beautiful Abandoned Train Stations Around The World
32,TRAVEL,Taylor Hanson Loves Tulsa
33,STYLE & BEAUTY,Chelsea Clinton & Princess Beatrice Party In London (PHOTOS)
34,TRAVEL,What To Do When You Encounter Dangerous Animals
35,TRAVEL,Sounds Of A Summer Night Down Under
36,FOOD & DRINK,10 Ways to Eat a Tortilla
37,STYLE & BEAUTY,Cheryl Cole Bra Plays Peekaboo At 'What To Expect' Premiere (PHOTOS)
38,TRAVEL,Prettiest Drives: Round Two
39,WELLNESS,"Humanizing the Doctor-Patient Relationship\, Online"
40,TRAVEL,A Vintage Addict Ransacks San Francisco
41,FOOD & DRINK,20 Simple Ways To Save Money On Groceries
42,HOME & LIVING,Why Your Pyrex Suddenly Shattered...And How To Clean It Up (PHOTOS)
43,STYLE & BEAUTY,Memorial Day Celebrations: 4 Tips for the Perfect Soirée
44,PARENTING,"Sakia David\, Mother Of Child Put In Washing Machine\, Says Son Was Under Babysitter's Care (VIDEO)"
45,PARENTING,"Eleanore Regan\, Woman With Brain Tumor\, Gave Birth Last Week\, Carried Olympic Torch"
46,WELLNESS,100 Tips for a Healthier Summer
47,DIVORCE,Do It For The Kids
48,WELLNESS,Perfecting Patience
49,WELLNESS,Finding Paradise in the Exotic and the Ordinary
50,STYLE & BEAUTY,Bikini Wax At Home? I Lived To Tell The Tale
51,TRAVEL,London Dining: Steak Near Covent Garden And Lesser Calamint Near Goodge Street
52,FOOD & DRINK,Indoor Grilling: How To Get Outdoor Barbecue Flavor
53,STYLE & BEAUTY,Queen Elizabeth II's Royal Academy Of Arts Visit Had The Best Red Carpet (PHOTOS)
54,PARENTING,6 Reasons to Hit the Farmers Market with Your Baby
55,WELLNESS,Getting Ahead of the Vitamin D Revolution Curve
56,WELLNESS,The Wisdom of Circular Thinking
57,STYLE & BEAUTY,"Soap Opera Hair: Julianne Moore\, Kelly Ripa And More Celebrities Before They Were Famous (PHOTOS)"
58,TRAVEL,"\Tourist\"" Is A Dirty Word. It Shouldn't Be."""
59,PARENTING,Kid's To-Do List: Adorable Tasks A Child Has To Complete In A Day
60,STYLE & BEAUTY,Kim Kardashian vs. Gwyneth Paltrow: Who Wore It Better? (PHOTOS)
61,WEDDINGS,"Left At The Altar: Steven Silverstein\, Jilted Groom\, Sues Former Fiancee Kendra Platt-Lee"
62,STYLE & BEAUTY,Lipstick Etiquette: To Apply or Not to Apply?
63,STYLE & BEAUTY,"Slits Are Getting Higher And Higher... Is There Any End In Sight? (PHOTOS\, POLL)"
64,WELLNESS,"Birth Control: Long-Acting Reversible Options Beat Pill\, Study Shows"
65,TRAVEL,Taylor Hanson Loves Tulsa
66,WELLNESS,10 Reasons Fish Make Good Pets
67,STYLE & BEAUTY,Sarah Ferguson's '80s Hipster Look...And How To Get It (PHOTOS)
68,WELLNESS,How Stress Makes You Fat
69,STYLE & BEAUTY,Summer Makeup Bag Update: These 14 Melt-Proof Essentials Will Keep You Cool All Summer
70,WELLNESS,WATCH: Tap Out Your Fears!
71,HOME & LIVING,Craft Of The Day: Make These Lace Socklets
72,WELLNESS,The List Method: How to Find 'The One'
73,FOOD & DRINK,Bartending Terms: What Do You Know? (QUIZ)
74,PARENTING,The Kids Are All Right: Gay Parents Raising Children
75,STYLE & BEAUTY,Kristen Stewart's Wild Pants At Cannes: Chic Or Shriek? (PHOTOS)
76,PARENTING,"Tara Dragon Hernandez\, Vice Principal\, Is Surprised With Flash Mob For Son With Cancer"
77,PARENTING,The Mother-Daughter Relationship: Complex at Age 5?
78,STYLE & BEAUTY,Priscilla Chan Ring: See Mark Zuckerberg's Wife's Unusual Wedding Jewelry
79,WELLNESS,A Sea of 'Happiness' Without Memory
80,WELLNESS,Art Helps People Live With Mental Illness
81,STYLE & BEAUTY,"Bikinis\, Stylish One-Pieces and The 11 Other Best Swimsuits For Your Shape (PHOTOS)"
82,TRAVEL,Empire State Building's Secret 103rd Floor (PHOTOS)
83,FOOD & DRINK,Toxic Food: Everyday Produce That Can Be Poisonous
84,PARENTING,The 'Inappropriate' Outfit That Got My Daughter Into Trouble At School
85,HOME & LIVING,Sprout Home Plant Of The Week: Nong Nooch Vine
86,DIVORCE,Celebrity Custody Battles: 10 Of The Messiest
87,PARENTING,Tanning Salons And Underage Teens: What Are The Laws? And Who's Bending The Rules?  (VIDEO)
88,WEDDINGS,"The Secret Of A Happy Marriage? Perfectly Simple\, Say Psychologists"
89,WELLNESS,The New (Ab)Normal: Portion Sizes Today vs. In The 1950s (INFOGRAPHIC)
90,WELLNESS,HuffPost Workouts: Music as a 'Getaway'
91,TRAVEL,Beating The Crowds In Venice (VIDEO)
92,WELLNESS,Let's Look at What We Call the 'Mind'
93,TRAVEL,8 Obscure National Parks Worth The Visit (PHOTOS)
94,HOME & LIVING,A Festive Summer Pizza Party
95,MONEY,Consumer Financial Protection Bureau Considers Rules For Prepaid Cards
96,STYLE & BEAUTY,Paris Packing Essentials: From The Stylelist Network
97,FOOD & DRINK,The Best Steak Cuts For Grilling (PHOTOS)
98,FOOD & DRINK,Soft Shell Crabs: How They Differ From Crabs
99,STYLE & BEAUTY,How To Wear An Asymmetrical Skirt: From The Stylelist Network
100,WELLNESS,American Fitness Index 2012: The Nation's Healthiest Cities
101,STYLE & BEAUTY,Kristen Stewart Lightens Up Her Wardrobe (And Her Attitude): Look Of The Day
102,PARENTING,Summer Camp Safety: Essential Questions Parents Should Ask
103,DIVORCE,Cheating Study: Men Who Cheat Are More Likely To Have Heart Attacks
104,MONEY,Managing Your First Week on a New Job
105,DIVORCE,Summer Parenting - Visitation And Custody In The Summer Months
106,TRAVEL,Abandoned Bermuda: Exploring An Old NASA Outpost On Cooper's Island
107,PARENTING,5 Ways Facebook Can Make You Feel Like the World's Worst Parent
108,WELLNESS,Why Do We Twitch As We're Falling Asleep?
109,PARENTING,Parenting And The Zen Of Roller Coaster Riding
110,FOOD & DRINK,Cardoons: In Season Now
111,WELLNESS,Being Indispensable: Willingness + Spirituality = Success
112,WEDDINGS,The Monogamy Trap
113,PARENTING,Women vs. Mothers
114,TRAVEL,Hyatt Offers A Helping Of Healthy Hospitality
115,PARENTING,Rite of Passage
116,TRAVEL,Forgetting Grandma
117,STYLE & BEAUTY,How To Wear Monochromatic Colors Without It Looking Like A Mistake (PHOTOS)
118,WELLNESS,Fitness Tips From Professional Dancers
119,DIVORCE,"Divorced\, But Dating Your Ex"
120,TRAVEL,An American's Search For London's 'Personal Bubble'
121,DIVORCE,Seven Ways to Cut the Stress of Divorce
122,STYLE & BEAUTY,8 Reasons Why You Should Go For Cropped Pants This Summer--All Under $100 (PHOTOS)
123,TRAVEL,"Dino Bones Are Plentiful In Alberta\, Canada (PHOTOS)"
124,TRAVEL,The World's Top 10 Treks (PHOTOS)
125,PARENTING,"My Son Takes a Punch\, My Heart Takes a Beating and Everything I Learned in Between"
126,WELLNESS,What Is The Meaning Of Life?
127,PARENTING,Raising a Hijab-Wearing Daughter in a World that Doesn't Understand
128,WELLNESS,"5 Pet Poisons Hiding in Your Purse\, Backpack or Work Bag"
129,WELLNESS,Roll With the Waves
130,FOOD & DRINK,Turmeric: How Do You Pronounce It?
131,TRAVEL,Old-Fashioned And New-Fangled Photographs Of Portugal And Spain  (PHOTOS)
132,STYLE & BEAUTY,"8 Stylish Beach Towels For The Sand\, Surf\, Pool And Other Summer Fun Spots (PHOTOS)"
133,STYLE & BEAUTY,The Perfect Summer Clutch: From The Stylelist Network
134,STYLE & BEAUTY,How To Wear Black Sequins: From The Stylelist Network
135,MONEY,More Americans Are Going To Pawn Shops To Get Fast Cash
136,TRAVEL,US Airways Flight 787 Diverted Over 'Suspicious' Behavior
137,PARENTING,"Breasts\, Bras and a RHONJ Parenting Fail"
138,HOME & LIVING,Repurposing Ideas: 5 Uses For Sugar That Don't Involve Baking
139,MONEY,4 Reasons Why You Should Check Your Score (Even If You Don't Plan to Borrow Money in the Near Future)
140,MONEY,"Patrick Cullen Of Cattaraugus\, New York\, Is The Nicest Banker In America"
141,PARENTING,It's TIME to Talk About Breasts (and Attachment Parenting)
142,PARENTING,More Kids at Risk for Lead Poisoning
143,WELLNESS,Nutrition Guidance: Facts About Opinions About Facts
144,STYLE & BEAUTY,It's Easy to Stay Young: Antioxidants to the Rescue
145,WEDDINGS,Wedding Planning Advice: Kids Give Their Take On Big Day Details On HelloGiggles (VIDEO)
146,PARENTING,Paid Parental Leave: It's About Time
147,STYLE & BEAUTY,"Gisele Pregnant Again? Supermodel Is Expecting Her Second Child\, Rumors Say"
148,STYLE & BEAUTY,Cameron Diaz Jumpsuit Braves The 'What To Expect' Red Carpet (PHOTOS)
149,TRAVEL,Finding Local Experiences Around The World
150,WELLNESS,Films for Your Soul: The Power of Images (WATCH)
151,STYLE & BEAUTY,"Fashion Trivia Quiz: Which Model Was In A Kanye West Music Video\, Who Wore Her Husband's Shirt To The Oscars And More"
152,WELLNESS,The Real Reason Downward-Facing Dog Is So Good for You
153,STYLE & BEAUTY,Emma Roberts Masters Denim Cut-Offs: Look Of The Day
154,FOOD & DRINK,Caper Recipes That'll Make You Love The Pickled Flower Bud
155,PARENTING,How a Grieving Mom Accidentally Rediscovered 'Fun'
156,STYLE & BEAUTY,Lea Michele Tattoos Are In 'Secret Spots' -- All 14 Of Them (VIDEO)
157,MONEY,FarmVille Gets Its Own American Express Prepaid Card
158,HOME & LIVING,Craft Of The Day: Make This Quirky Clothespin Chandelier
159,MONEY,A Marriage Made of Money
160,WELLNESS,SLIDESHOW: Our 2nd 'Most Fearless Tweet' Finalist!
161,TRAVEL,"Reinventing Live Television\, 60 Feet Underwater (VIDEO)"
162,STYLE & BEAUTY,Weekly Roundup of eBay Vintage Clothing Finds (PHOTOS)
163,TRAVEL,Finding America's Past In Australia's Present
164,PARENTING,45 Ideas for Summer Fun with Kids
165,WEDDINGS,Tips to Consider When Choosing Your Wedding Week Wardrobe
166,WELLNESS,I Am Fly. It Says So On My Nametag.
167,MONEY,Who Will Win the Battle for the Mobile Wallet?
168,WELLNESS,GPS to a Quiet Mind: 6 Meditative Steps to Freedom
169,PARENTING,"Memories\, Good\, Really Bad and Good Again??"
170,STYLE & BEAUTY,What SPF Should You Be Wearing? A Top Dermatologist Answers Our (Burning) Sunscreen Questions
171,WELLNESS,Is Your Humor Hurting People?
172,FOOD & DRINK,Pasta With Ramps And A Light Cream Sauce
173,FOOD & DRINK,"Plum Recipes: Jam\, Cakes And Pies (PHOTOS)"
174,DIVORCE,Billy Bob Thornton: Angelina Jolie And I Are 'Great Friends'
175,PARENTING,Moms' Club: The New Happy Hour?
176,STYLE & BEAUTY,World Goth Day Is Here! Check Out These Celebs Who Have Gone 'Goth' (PHOTOS)
177,PARENTING,"Ashley Sanchez\, Mom\, Saves Infant's Life Using CPR"
178,WEDDINGS,First Look: ShoeDazzle Launches Bridal Footwear For $50 And Under
179,WEDDINGS,Royal Wedding: Prince William Barely Slept Before Marrying Kate
180,MONEY,Couple Who Tried To Sell Rosetta Stone On eBay To Pay For Headstone Accused Of Piracy
181,DIVORCE,Should Kids Call Stepparents 'Mom' And 'Dad'?
182,MONEY,"Trulia's Housing Barometer: Recovery Slowly\, Steadily Pushes Ahead"
183,WELLNESS,Scientists Sequence Genomes Of 12 Antibiotic-Resistant Staphylococcus Aureus Strains
184,STYLE & BEAUTY,A Conversation With Designer Reed Krakoff
185,STYLE & BEAUTY,Lady Victoria Hervey's Sheer Cannes Dress Fails To Hide Her White Underwear (PHOTOS)
186,STYLE & BEAUTY,Tilda Swinton Covers Candy Magazine Wearing Actual Makeup (PHOTO)
187,WELLNESS,Tafamidis: FDA Shoots Down Drug For Familial Amyloid Polyneuropathy
188,PARENTING,"Cole's Bucket List: Avery's Bucket List Inspires Parents Of 4-Year-Old Cole Rapini\, Boy With Undiagnosed Condition"
189,FOOD & DRINK,"Pluots\, Apriums\, Plumcots\, Apriplums: What's The Difference?"
190,WELLNESS,Foraging for Ramps: 5 Rules Everyone Should Know
191,PARENTING,Age 5 Is Not too Early to Learn Your Child Might Be Transgender
192,PARENTING,"Autism Scientists Search For Help\, For Their Own Kids' Sakes"
193,STYLE & BEAUTY,"Lauren Odes\, Former Native Intimates Employee\, Claims She Was Fired Over 'Too Hot' Appearance"
194,TRAVEL,Hologram Woman Will Soon Be Helping Guests At New York Area Airports
195,MONEY,The Easy Way to Fix a Credit Report Error
196,STYLE & BEAUTY,Pattie Boyd's Mod '60s Look...And How To Get It (PHOTOS)
197,WEDDINGS,Last Name Fails: Wedding Announcements That Spell Disaster (PHOTOS)
198,WELLNESS,How to Get Things Done: Separate Your Work Modes
199,TRAVEL,A Day Trip To Atlantis' Aquaventure Water Park In Dubai (PHOTOS)
200,WELLNESS,Restaurant Portion Size: Nearly All Entrees Exceed Nutrition Recommendations
201,WELLNESS,Minimize Distraction to Restore Connection
202,DIVORCE,Celebrity Divorce: Star Couples Who Vowed Never To Split
203,HOME & LIVING,Justin Timberlake And HomeMint's Design Contest: Winner Natalie Wolfe
204,STYLE & BEAUTY,Prince William: I Only Got Half An Hour Of Sleep Before The Royal Wedding
205,WELLNESS,Death Rate Drops Among Americans With Diabetes: CDC
206,TRAVEL,Casinos And Small Changes In Venice
207,WELLNESS,What's the Most Popular Resolution for Happiness?
208,PARENTING,Remembering Bedtime
209,WELLNESS,What Does Having Sex Mean to You?
210,HOME & LIVING,Weekly Roundup of eBay Vintage Home Finds
211,WELLNESS,"Weight Loss Could Decrease Estrogen\, A Known Risk Factor For Breast Cancer: Study"
212,TRAVEL,"Swimming With Whale Sharks In Isla Mujeres\, Mexico (PHOTOS)"
213,STYLE & BEAUTY,The Webster's New Target Collection Hits Bullseye (PHOTOS)
214,WELLNESS,The View from My 31st Birthday
215,PARENTING,My Buffer: In Memoriam
216,WELLNESS,Stress Relief: 7 Calming Workouts That Aren't Meditation
217,TRAVEL,Five Reasons To Visit Peru That Aren't Machu Picchu (PHOTOS)
218,HOME & LIVING,Decor Ideas: How To Create A Staircase Photo Gallery In Your Home (VIDEO)
219,DIVORCE,Divorce Diaries: I'm Excited To Be Interested In My Life
220,TRAVEL,Rancho Pescadero: An Antidote To Cabo On The Road To Todos Santos
221,WELLNESS,How to Align Your Values and Your Life
222,HOME & LIVING,"Buying Guide: Find The Best Outdoor Dining Set For Your Backyard\, Garden\, And Patio (PHOTOS)"
223,DIVORCE,Why Divorce Doesn't Always End A Relationship
224,WELLNESS,Fighting My Mother's Cancer With Text Messages
225,WELLNESS,Be Empowered by Your Career
226,DIVORCE,4 Ways to Manage Summer Media with Your Ex
227,WELLNESS,Double-Dipping Workouts
228,WELLNESS,Pop Playlists From Top Trainers And Fitness Instructors
229,WELLNESS,Top 5 Reasons Women Seek Holistic Remedies
230,WELLNESS,New Science Behind Kicking Those Stubborn Food Cravings
231,WELLNESS,The Evil Gender Bias of Obesity and Weight Gain
232,WEDDINGS,Extreme Proposals: 5 Unforgettably Crazy Ways To Pop The Question (VIDEO)
233,PARENTING,"Dylan\, Boy With Cystic Fibrosis\, Dances To 'Dynamite' (VIDEO)"
234,TRAVEL,Explore America: Inside Ohio's Beautiful Cuyahoga Valley National Park
235,STYLE & BEAUTY,"Beauty Street Style: Jessie Groveman\, Yoga Instructor\, Nails The Beachy-City Look"
236,FOOD & DRINK,12 Ways Egg Whites Can Lighten Up Your Meal
237,HOME & LIVING,Craft of the Day: Make A DIY Flower Basket From A Paper Bag
238,FOOD & DRINK,Every Cookie Recipe You'll Ever Need (And Then Some)
239,TRAVEL,What Gives Them The Right To Frisk Henry Kissinger?
240,WELLNESS,Please Meditate: Gratitude for Your Body (VIDEO)
241,PARENTING,Mama Moments: Taking the Good with the Bad
242,WELLNESS,Too Good To Be True? A History Of Dubious Fitness Gadgets
243,STYLE & BEAUTY,"American Idol: What They Wore\, 5/16/12 (Final 3)"
244,TRAVEL,Prettiest Drives: Which Is The Best US Road Trip Route?
245,STYLE & BEAUTY,"Miley Cyrus Billboard Music Awards 2012: Singer Wears Pantless\, Sideboob-Revealing White Blazer (PHOTOS)"
246,WELLNESS,How to Make Organic Food Shopping Fun for Kids (and Parents!)
247,STYLE & BEAUTY,Billboard Music Awards 2012: Red Carpet Fashion Straight From Las Vegas (PHOTOS)
248,DIVORCE,How To Break Up With Someone: 21 Worst Ways
249,DIVORCE,10 Tips To Avoid A Costly Divorce
250,STYLE & BEAUTY,Aurelie Saada & Sylvie Hoarau Are Our New Style Obsessions (PHOTOS)
251,PARENTING,Boy Draws The Hulk Smashing The Kardashians (PHOTO)
252,DIVORCE,"Postnups Becoming More Popular\, But They're Not For Everyone"
253,DIVORCE,Child Custody - In Whose Best Interests?
254,PARENTING,The Top 10 Money Pitfalls Moms Should Watch Out For
255,STYLE & BEAUTY,Candice Huffine Covers S Moda In Yet Another Naked Plus-Size Cover (PHOTOS)
256,STYLE & BEAUTY,Priscilla Chan Wedding Dress: The Details On Mark Zuckerberg's Wife's Wedding Gown
257,PARENTING,Moving Beyond a Biomedical View of Co-Sleeping
258,STYLE & BEAUTY,Carly Rae Jepsen Age Confusion: The 26-Year-Old Who Dresses Like A Tween (PHOTOS)
259,WEDDINGS,Real Weddings: Couples Who Got Married This Weekend (PHOTOS)
260,WEDDINGS,Wedding Dance: Bride And Groom Entertain Guests With Funny Routine (VIDEO)
261,STYLE & BEAUTY,DIY Nail Art: Blue And Black Geometric Print Manicure
262,HOME & LIVING,"Design Tips: 7 Unusual Ways Your Home Can Make You Happier\, Healthier (PHOTOS)"
263,WELLNESS,Why We Create Moral Issues
264,FOOD & DRINK,"5 Mistakes You're Making With Cupcakes\, And How To Avoid Them"
265,WELLNESS,Weight Loss Success: Jason Barsotti Wanted To Get Healthy For His Daughter And Lost 120 Pounds
266,PARENTING,What You NEVER Expect When You're Expecting
267,WELLNESS,How Well Will I Get?
268,PARENTING,5 Lies Moms of Teens Tell
269,STYLE & BEAUTY,Naomi Campbell's Beauty Evolution: From Just A Face To Controversial Supermodel (PHOTOS)
270,DIVORCE,Arnold Schwarzenegger: Maria Shriver and I 'Get Along Really Well' (VIDEO)
271,WELLNESS,"C. Diff Infections Are Rising\, Study Finds"
272,WELLNESS,50 Awesome Pre And Post-Workout Snacks
273,PARENTING,Top 5 Ways to (Temporarily) Ditch Your Kids
274,WEDDINGS,Gaming The Green Card System: One Immigrant's Fake Marriage Tale
275,WEDDINGS,"Mark Zuckerberg Prenup: Billionaire Facebook Founder Weds Priscilla Chan\, Was There a Prenup?"
276,WEDDINGS,How Does Marital Status Affect Your Federal Taxes
277,WELLNESS,Wake Up and Live
278,WEDDINGS,The Offer
279,HOME & LIVING,Selecting the Right Outdoor Ceiling Fan
280,HOME & LIVING,How To Clean A Can Opener So It Works Like New
281,PARENTING,Three Ways Kids Can Find Happiness on Facebook
282,WEDDINGS,How To Choose A Wedding Dress You Won't Regret
283,FOOD & DRINK,Tips For Making The Perfect Hot Dog
284,WELLNESS,"Fear Of Spiders Overcome By A Single Therapy Session\, Study Finds"
285,PARENTING,Child Put Inside Washing Machine At Laundromat (VIDEO)
286,MONEY,Why We All Need to Think About Alternative Credit
287,STYLE & BEAUTY,"Queen Elizabeth II Has Assistants Break In Her Shoes\, Document All Her Outfits"
288,WELLNESS,Fending Off Fitness Fatigue
289,WELLNESS,Top 5 Hormone Superheroes: My 'Genius Bar'
290,STYLE & BEAUTY,Billboard Music Awards 2012: Red Carpet Fashion Straight From Las Vegas (PHOTOS)
291,STYLE & BEAUTY,"Miley Cyrus Billboard Music Awards 2012: Singer Wears Pantless\, Sideboob-Revealing White Blazer (PHOTOS)"
292,STYLE & BEAUTY,Taylor Swift's 2012 Billboard Music Awards Look Is All Grown Up (PHOTOS)
293,PARENTING,"Celebrities Who Breastfeed: Alanis Morissette\, Mayim Bialik\, Beyonce And More"
294,STYLE & BEAUTY,Pippa Middleton Wears Version Of Kate Middleton's Issa Dress To Friend's Wedding (PHOTOS)
295,MONEY,Financial Buddies Help Friends Stay On Track With Their Spending
296,WEDDINGS,Sandy Malone: 'The Moment I Knew I Wanted To Marry My Spouse' (VIDEO)
297,WELLNESS,Sleepy Surgeons: New Study Shines Light On Risks Of Surgeon Fatigue
298,WELLNESS,The View's 'Fat Show': The Co-Hosts And Lead Experts Talk Obesity
299,STYLE & BEAUTY,"Gucci vs. Guess Lawsuit Decision: Gucci Wins $4.66 Million\, Ban On Knock-offs"
300,TRAVEL,A Minor Diversion: Traveling In Greece During The Crisis
301,STYLE & BEAUTY,Goldie Hawn's Fierce Leopard Look...And How To Get It (PHOTOS)
302,STYLE & BEAUTY,I Still Wear My Prom Dress -- And I'm Not Ashamed To Tell You (PHOTOS)
303,TRAVEL,Our Girl in Havana: A Bohemian Chic Eatery In Cuba
304,TRAVEL,"World's Most And Least Touristed Places\, According To BlueMoon And Google Maps"
305,TRAVEL,Italy's Most Appreciated Breast (VIDEO)
306,HOME & LIVING,House Tour: Sharon Stone's Mediterranean Mansion
307,FOOD & DRINK,"Ice Cream: Mouth-Watering Shots Of Chocolate\, Strawberry And More (PHOTOS)"
308,WELLNESS,"Teen Diabetes: Cases Double\, Other Heart Risks Still High"
309,WELLNESS,Preventing Degenerative Brain Disease in Our Children
310,WEDDINGS,Getting To Know A Photographer Online
311,WELLNESS,The Voice Of Fear Vs. The Voice Of Wisdom
312,STYLE & BEAUTY,Are These iPad Cases Or Clutches? You Decide (PHOTOS) (PHOTOS)
313,WELLNESS,11 Surprising Symptoms Of Acid Reflux
314,WELLNESS,What Food Labels Really Mean
315,WELLNESS,My Fear Toolkit
316,WELLNESS,Making Significant Changes in Your Early 40s
317,STYLE & BEAUTY,Vanessa Williams' Poolside Glamour...And How To Get It (PHOTOS)
318,WELLNESS,Spring Cleaning -- or Not
319,WELLNESS,How I Learned to Stop Fearing My Reflection
320,WELLNESS,Can Social Networks Cure Disease? Part I
321,WELLNESS,Lana Kuykendall Flesh-Eating Bacteria: 36-Year-Old Mom Has Undergone 7 Operations
322,WELLNESS,What's Behind Emotional Overeating?
323,STYLE & BEAUTY,"American Idol: What They Wore\, 5/9/12 (Top 4)"
324,STYLE & BEAUTY,Jessica Mauboy Wardrobe Malfunction Is Just Centimeters Away At Cannes (PHOTOS)
325,STYLE & BEAUTY,Ashlee Simpson Daringly Pairs A T-Shirt And Birkin Bag: Look Of The Day
326,HOME & LIVING,Inside Country Living's June 2012 Issue: A California Home With 'Retro Tropical' Style (PHOTOS)
327,WELLNESS,A Good Night's Sleep Or Good Sex? Do Mattresses Force Us To Choose?
328,STYLE & BEAUTY,Jessica Mauboy Wardrobe Malfunction Is Just Centimeters Away At Cannes (PHOTOS)
329,TRAVEL,Where To Go When You've Summered Everywhere (PHOTOS)
330,STYLE & BEAUTY,This Week In Beauty: Cannes Film Festival 2012 Updos vs. Free-Flowing Locks (PHOTOS)
331,WELLNESS,Planning Is Less Effective When You're Juggling Multiple Goals: Study
332,WELLNESS,The Inexperience Advantage
333,PARENTING,"My Son\, Myself: A Father's Cross Country Journey With a Son He Doesn't Understand"
334,TRAVEL,Spookiest US Cemeteries: What's Your Most-Visited?
335,STYLE & BEAUTY,"Inkhosikati LaMbikiza\, 'First Lady' Of Swaziland\, Is Our New Style Queen (PHOTOS)"
336,WELLNESS,Who Are We Without Our Titles?
337,TRAVEL,Sticker Shock: 5 Of The World's Most Expensive Hotel Suites (PHOTOS)
338,COMEDY,Bill Maher: Liberty University Is Not A Real School
339,COMEDY,'Lazy Sunday' 2: Andy Samberg & Chris Parnell Reprise First 'SNL' Digital Short
340,COMEDY,Stefon Stocks 'SNL' With Family Summer Fun Ideas On 'Weekend Update' (VIDEO)
341,COMEDY,Mick Jagger Reacts To Impressions Of Himself On 'SNL' (VIDEO)
342,COMEDY,"Jon Hamm\, Kristen Wiig Heat Up 'SNL' In 'Lawrence Welk Show' Cold Open (VIDEO)"
343,COMEDY,Jon Stewart's Republican Primary Highlights On 'The Daily Show' (VIDEO)
344,COMEDY,The Best Late Night Clips of the Week (VIDEO/PHOTOS)
345,CRIME,Dharun Ravi Sentencing: How Should The Former Rutgers Student Be Punished? (VOTE)
346,BLACK VOICES,Tank: Blake Griffin Doesn't Talk For A Reason: Love Of The Game
347,BLACK VOICES,15 Figure-Flattering Swimsuits For Memorial Day Weekend And Beyond (PHOTOS)
348,BLACK VOICES,This Week's Top 10 News Stories From Africa
349,BLACK VOICES,Magic And The HIV-Positive Girl Who Changed Him 20 Years Ago
350,SCIENCE,SpaceX Launch Abort Traced To Faulty Rocket Engine Valve
351,SCIENCE,Eclipse: Astronauts May See Moon's Shadow From ISS
352,SCIENCE,"Exoplanet Turning To Dust Under Parent Star's Intense Heat\, Scientists Say"
353,QUEER VOICES,Gay Republicans Encounter Same-Sex Marriage Dilemma
354,QUEER VOICES,Transgender At Five
355,IMPACT,G(irls) 20 Summit: Catching Up With Women Farmers
356,IMPACT,Charity Impossible: Do America's Charities Need Rescuing?
357,ENVIRONMENT,"Baby Chick And Cat Snuggle\, Cat Unimpressed (VIDEO)"
358,ENVIRONMENT,Prey Lang: A Forest on the Brink of Destruction (PHOTOS)
359,ENVIRONMENT,Rocket Trike Diaries: Week 7
360,BUSINESS,The NBA Pass: When Monopoly Met Oligopoly
361,BUSINESS,Is Insider Trading Part Of The Fabric On Wall Street?
362,BUSINESS,Wolfgang Schaeuble: 'It's Up To Greece To Abide By Its Obligations'
