ID,category,description
5323,WELLNESS,Supplemental Life
5324,WELLNESS,Taking Timeouts to Decrease Stress and Increase Creativity
5325,TRAVEL,Seder at Sea: Remaining Connected Far From Home
5326,WEDDINGS,19 Unique Groom's Cake Ideas
5327,FOOD & DRINK,Cookbooks We Love: Weeknights With Giada
5328,TRAVEL,The Best Cities To Visit During The Springtime (PHOTOS)
5329,FOOD & DRINK,The Rhubarb Recipes You've Been Waiting For All Year
5330,FOOD & DRINK,10 Sweet And Savory Maple Syrup Recipes (Photos)
5331,STYLE & BEAUTY,Mariah Carey's Style Evolution (PHOTOS)
5332,STYLE & BEAUTY,Five Ways to Wear Neon (or) How to Blind Your Friends and Look Cool
5333,STYLE & BEAUTY,Controversial
5334,WELLNESS,How Hot Is Your Anger?
5335,PARENTING,Breaking the Consumer Addiction
5336,PARENTING,Why One Mom Sent Her Son to a Secret Preschool Co-op
5337,WELLNESS,'Xanax' Nation? My Anti-Anxiety Meds Give Me Enough to Worry About
5338,MONEY,"Gen-X/Gen-Y Wealth Is Coming to Wall Street -- Financial Services Needs to \Catch the Wave\"""""
5339,STYLE & BEAUTY,Jean Paul Gaultier: Beyond Couture
5340,TRAVEL,Skiing Spring Powder In The Canadian Rockies
5341,WELLNESS,Why Celebrate?
5342,WELLNESS,How the Fattest Kid in School Became the Weight Loss Guru
5343,PARENTING,Chocolate Bunny vs. Matzo: the Spring Dilemma
5344,PARENTING,The 'Joys' of Mother-Daughter Shoe Shopping
5345,FOOD & DRINK,A Lotta Ricotta
5346,WELLNESS,What Can We Learn From Whitney Houston's Autopsy Results About Our Own Addictions?
5347,TRAVEL,The Coolest New Disney Vacations (PHOTOS)
5348,WEDDINGS,The Wedding Dress
5349,WELLNESS,Super Healthy Dinner Recipes
5350,DIVORCE,Divorce Expo: HuffPost Divorce Hosts A Panel On Infidelity At Start Over Smart Expo In NYC
5351,PARENTING,Why We Should Care About Children's Fashion
5352,PARENTING,Children's Fashion Is Not Important
5353,MONEY,Giving to Charity: How Much Can I Deduct From My Taxes?
5354,TRAVEL,10 Seafood Adventures Across The Globe (PHOTOS)
5355,TRAVEL,Seven Sweet Spots For Spring Savings (PHOTOS)
5356,WELLNESS,Your Cat May Need Protection From Heartworm
5357,WELLNESS,Feng Shui My Soul
5358,WELLNESS,Our Body's Balancing Signals for Hair Loss and More
5359,TRAVEL,Baboons Make Joy From A Puddle (PHOTOS)
5360,MONEY,House Poor but Keeping Up With the Joneses
5361,STYLE & BEAUTY,"ASOS Is Trendy\, Cheap And Most Importantly\, Michelle Obama Is A Fan (PHOTOS)"
5362,PARENTING,No 'Hunger Games' For My 11-Year-Old
5363,TRAVEL,Portland Rothko Retrospective Brings Artist Home
5364,STYLE & BEAUTY,"Silver Accessories: 15 Bags\, Shoes And Baubles (PHOTOS)"
5365,WELLNESS,What 'Fat Talk' Does To Your Mental Health
5366,HOME & LIVING,CustomMade Curator: Knot Bench
5367,PARENTING,"Eating The Placenta: January Jones Does It\, But Not All Moms On Board"
5368,TRAVEL,JetBlue Flight Diverted After Captain Reportedly Tries To Storm Cockpit (VIDEO)
5369,WEDDINGS,Shotgun Wedding: Las Vegas Gun Shop Now Provides Wedding Ceremonies
5370,STYLE & BEAUTY,Dolce & Gabbana Sues Over 'Dolce And Banana' Boutique
5371,PARENTING,POLL: Does 'The Hunger Games' Make You Uncomfortable?
5372,WEDDINGS,Anne Hathaway's Quirky Engagement Party: All The Details!
5373,WEDDINGS,"Coal Miner's Daughter\, Chinese Style: Media Rips Rumored $11 Mln Wedding"
5374,PARENTING,Mr. Gregory Goes to Work
5375,STYLE & BEAUTY,Lady Gaga's Style Evolution (PHOTOS)
5376,WELLNESS,Bobby Brown's Arrest For DUI: His Addiction History Explained
5377,PARENTING,HuffPostParents' 'The Look' Sweepstakes Official Rules
5378,STYLE & BEAUTY,Kate Winslet 'Titanic 3D' Premiere: Then & Now (PHOTOS)
5379,STYLE & BEAUTY,"Candice Swanepoel\, Victoria's Secret Angel\, On Bikinis\, Brazil And Her Future Singing Career (PHOTOS)"
5380,HOME & LIVING,How To Choose The Right Clothes Hangers
5381,STYLE & BEAUTY,Marion Cotillard Lady Dior Ad Makes Us Lust For A New Bag (PHOTO)
5382,STYLE & BEAUTY,"Candice Swanepoel\, Victoria's Secret Angel\, On Bikinis\, Brazil And Her Future Singing Career (PHOTOS)"
5383,HOME & LIVING,Repurposing Ideas: 5 New Uses For Socks
5384,WELLNESS,Evolutionary Reason For Runner's High?
5385,MONEY,"Birth Rate Plummets\, Young Americans Too Poor To Have Kids"
5386,WELLNESS,"Early Dose Of Glucose\, Insulin And Potassium Thwarts Cardiac Arrest: Study"
5387,STYLE & BEAUTY,Louboutin 'SEX' Shoes: Guys Weigh In! (PHOTOS)
5388,MONEY,"Financial Advisors Are Biased\, Study Finds"
5389,WELLNESS,Why the New Surgical Cure for Diabetes Will Fail!
5390,HOME & LIVING,Weekly Roundup of eBay Vintage Home Finds (PHOTOS)
5391,PARENTING,A Parent's Predicament: Does Winning at Work Mean Losing at Home?
5392,FOOD & DRINK,How To Cocktail Video: The Cosmopolitan
5393,STYLE & BEAUTY,Glamour Magazine Shows 'What Your Shoes Say To Guys'
5394,WEDDINGS,Why Peeta And Katniss From 'The Hunger Games' Should Get Engaged
5395,WEDDINGS,The China Pattern Or The China Adventure?
5396,STYLE & BEAUTY,Jaime King In Prabal Gurung: Look Of The Day
5397,STYLE & BEAUTY,Dangle Earrings Are A Must-Have For Spring (PHOTOS)
5398,STYLE & BEAUTY,"Fashion Smackdown: Dakota Fanning's Mouse vs. Daphne Groeneveld's Goldfish (PHOTOS\, POLL)"
5399,STYLE & BEAUTY,Dolce & Gabbana Sues Over 'Dolce And Banana' Boutique
5400,STYLE & BEAUTY,Joan Collins Covers 'Ponystep' As British Icon (PHOTOS)
5401,STYLE & BEAUTY,Christie Brinkley Divorce: Model Says She 'Just Wants Peace' With Ex Peter Cook (VIDEO)
5402,PARENTING,A Return to Childhood: A Review of How the Heather Looks by Joan Bodger
5403,WELLNESS,Will Cheney's New Heart Make Him Nicer?
5404,PARENTING,For Trayvon
5405,STYLE & BEAUTY,"Luciano Conti Professional's Photoshop Disappearing Act? (PHOTO\, VIDEO)"
5406,WELLNESS,"Richard Lee Norris\, Injured In Gun Accident\, Gets Face Transplant"
5407,PARENTING,Take a Stand against Bullying Children with Disabilities
5408,STYLE & BEAUTY,Looking for Patterns In Your Wardrobe... and I Don't Mean the Ones on Your Clothes
5409,STYLE & BEAUTY,"Diana Ross Birthday: Singer Turns 68\, Style Evolution (PHOTOS)"
5410,STYLE & BEAUTY,Irina Shayk Thong Makes An Appearance At Jeffrey Fashion Cares (PHOTOS)
5411,STYLE & BEAUTY,Marion Cotillard Lady Dior Ad Makes Us Lust For A New Bag (PHOTO)
5412,STYLE & BEAUTY,Designer Shoe Prices A \Concern\
5413,HOME & LIVING,Mies Van Der Rohe: Celebrating His Architectural Legacy Around The World (PHOTOS)
5414,TRAVEL,"Lauren Scruggs\, Model Who Walked Into Plane Propeller\, Sues Over Incident"
5415,WELLNESS,"Blood Sugar Solution Challenge\, Day 29: Eat 'Good' White Foods"
5416,MONEY,Parents Would Rather Talk About Drugs Than Money
5417,PARENTING,In Praise Of Germs: Why Common Bugs Are Necessary For Kids
5418,PARENTING,Parents As Researchers: Musical Lessons From Our Children
5419,WEDDINGS,Forgiveness: When It Counts In Your Marriage
5420,TRAVEL,Sizing Up Sleep: The Best Hotel Beds EVER (PHOTOS)
5421,WELLNESS,Women: Why Weights?
5422,DIVORCE,"Divorce Date Conversations: What to Say\, What to Avoid"
5423,STYLE & BEAUTY,A Dress Worthy of a Nobel Prize
5424,TRAVEL,What The Heck Is AMS?
5425,DIVORCE,8 Reasons NOT To Contact His Mistress
5426,WELLNESS,Weight Loss Success: Condola Williams Took Control Of Her Health And Lost 115 Pounds
5427,WELLNESS,Bad Doggie Breath? Chew on This
5428,PARENTING,Are you a sMotherer? When is Loving Too Much Too Much?
5429,FOOD & DRINK,Supermarket Guide To Buying Chicken
5430,TRAVEL,Meeting The New President Of The Explorers Club (VIDEO)
5431,STYLE & BEAUTY,Keira Knightley's Style Evolution (PHOTOS)
5432,FOOD & DRINK,What's The Sweet In That French Onion?
5433,FOOD & DRINK,7 New And Elegant Seder Plates For The Passover Table
5434,STYLE & BEAUTY,"Early Morning Rebel's Favorite Things Include Sunglasses\, Vintage Boots and White Tees"
5435,WELLNESS,Arnold Palmer's High Blood Pressure: What Role Does Medication Play?
5436,MONEY,Danish Lottery Mistake: 300 Players Accidentally Told They'd Won Millions (VIDEO)
5437,STYLE & BEAUTY,"'Fabulous Nobodies\,' New Film From R.J. Cutler\, Now Being Cast"
5438,HOME & LIVING,DIY Idea: Sunburst Mirror
5439,PARENTING,When My Son Became A Biter
5440,TRAVEL,Boston Logan TSA Workers Hospitalized Over Bag Odor
5441,MONEY,"Costco Refuses to Cash Check\, Man Tears Check Up In Frustration"
5442,MONEY,"Credit Card Rewards\, Miles To Tempt Affluent Into Spending"
5443,WELLNESS,"Blood Sugar Solution Challenge\, Day 28: Beans for Life"
5444,STYLE & BEAUTY,Dakota Fanning Glasses: The Perfect Evening Accessory? (PHOTOS)
5445,TRAVEL,Virgin Atlantic's 'Upper Class Red' Lipstick Debuts (PHOTOS)
5446,STYLE & BEAUTY,Neon Nail Polish: 11 Celebrities Show Off Bright Manicures (PHOTOS)
5447,TRAVEL,Explore America: One Of Ohio's Best Kept Secrets Is Wine
5448,MONEY,4 Ways Prepaid Card Vendors Can Help Reduce Consumer Anxiety
5449,FOOD & DRINK,The Best Asparagus Recipes You Can Eat This Spring
5450,TRAVEL,Traveling With Kids: The Time Is Always Right
5451,TRAVEL,"Rio De Janeiro And The \Waters of March\"""""
5452,PARENTING,What Parents Can Do When Bullying is Downplayed at School
5453,WELLNESS,3 Steps to Moving Beyond the Recession
5454,PARENTING,What Happens at the Lunch Table Stays at the Lunch Table? NOT
5455,STYLE & BEAUTY,"Rihanna\, Princess Diana And 32 Other Stars Who Love A Choker Necklace (PHOTOS)"
5456,STYLE & BEAUTY,"Angelina Jolie\, Madonna\, Kristen Stewart And More Stars In Black And White (PHOTOS)"
5457,PARENTING,How to Plan a College Tour from Hell
5458,WELLNESS,How I Found a Natural Sinus Cure
5459,WELLNESS,5 Pilates Myths
5460,WELLNESS,Why Keeping A Secret Feels So Physically Burdensome
5461,TRAVEL,Is Downtown Salt Lake City Finally Sexy? (PHOTOS)
5462,TRAVEL,10 Colorful Spring Festivals Worth The Trip (PHOTOS)
5463,STYLE & BEAUTY,Weekly Roundup of eBay Vintage Clothing Finds (PHOTOS)
5464,PARENTING,Cheers!  What Kids Learn from the Media About Drinking
5465,WELLNESS,Autism 'Awareness'
5466,PARENTING,Marx Brothers Guide to Fatherhood
5467,STYLE & BEAUTY,Blue Jeans & White Shit: From The Stylelist Network
5468,STYLE & BEAUTY,Mindy Byrd's Fashion Collages: From The Stylelist Network
5469,STYLE & BEAUTY,A Red Dress For Spring: From The Stylelist Network
5470,WELLNESS,Transcendental Meditation: Oprah And Other Celebs Who Embrace The Practice
5471,WELLNESS,"Rock\, Paper\, Scissors: A Dialogue -- Part Four"
5472,TRAVEL,Why Does Everyone Hate The TSA? (VIDEO)
5473,WELLNESS,Releasing the Past
5474,STYLE & BEAUTY,"Bethenny Frankel: Mother\, SkinnyGirl Mogul\, Skin Care Expert?"
5475,WELLNESS,"Chronic Headaches Common In Soldiers After Concussion\, Survey Shows"
5476,HOME & LIVING,Decorating Trends: 7 Furniture Pieces And Home Accessories That Are Going 'Extinct'
5477,STYLE & BEAUTY,Jennifer Lopez In Michael Kors: Look Of The Day
5478,FOOD & DRINK,Springtime Inspiration: A Tablescape And Menu
5479,FOOD & DRINK,What Is Resurrection Cheese?
5480,WEDDINGS,Think Before You (Design) Speak
5481,HOME & LIVING,Spring Cleaning: Taking Closet Inventory
5482,PARENTING,Kids and Exercise
5483,WELLNESS,The One Person (You'd Never Expect) Who's Causing Your Pain
5484,TRAVEL,A 'Unique' Retreat In Sao Paulo
5485,STYLE & BEAUTY,H&M Luxury Collection May Be In The Works: REPORT (POLL)
5486,STYLE & BEAUTY,Hitler Shampoo Commercial Will Probably Offend Tons Of People (VIDEO)
5487,MONEY,Digital Wallets: Mobile Payment Methods Take Place Of Wallets
5488,STYLE & BEAUTY,'Mad Men' Inspired Nails And More Of Our Weekend Manicures (PHOTOS)
5489,WELLNESS,"Heart CT Scans In ERs Could Save Hospitals Billions\, Study Shows"
5490,PARENTING,Pregnancy Increases Heart Attack Risk
5491,PARENTING,How Parents Are Changing The Course Of Autism Research
5492,WELLNESS,"HCG Drops Aren't Effective For Weight Loss\, Experts Say"
5493,MONEY,A Cure for Anxiety
5494,STYLE & BEAUTY,Weird Beauty: Is It Ok To Wear Home Spray As Perfume?
5495,STYLE & BEAUTY,"Tyson Beckford: I Helped My Girlfriend Tone Up\, Become A Real Model"
5496,STYLE & BEAUTY,"Victoria Beckham Haircut: Too Short\, Too Long Or Just Right? (PHOTOS\, POLL)"
5497,STYLE & BEAUTY,H&M Luxury Collection May Be In The Works: REPORT (UPDATE)
5498,TRAVEL,A Girls Guide to Bonefishing
5499,WELLNESS,Chocolate Eating Linked To Lower BMI
5500,STYLE & BEAUTY,"Models In Bikinis: Doutzen Kroes\, Anne V. & Irina Shayk Hit The Miami Beaches! (PHOTOS)"
5501,WELLNESS,6 Major Health Problems You Could Create By Shorting Yourself Sleep
5502,STYLE & BEAUTY,"Victoria Beckham Haircut: Too Short\, Too Long Or Just Right? (PHOTOS\, POLL)"
5503,TRAVEL,Angkor Wat: Australia Donates $1 Million For Preservation (PHOTOS)
5504,TRAVEL,Jetstar Hong Kong: Qantas And China Eastern Collaborate On New Budget Airline
5505,MONEY,"Student Loan Debt: Top 1 Percent Of Borrowers Owe More Than $150\,000 In Loans"
5506,STYLE & BEAUTY,"Tyson Beckford: I Helped My Girlfriend Tone Up\, Become A Real Model"
5507,STYLE & BEAUTY,A Conversation With Bally's Menswear Designer Graeme Fidler
5508,WELLNESS,Oprah's Next Chapter: Meditation -- In 'America's Most Unusual Town'
5509,WELLNESS,"Consciousness\, Not Just Another Buzzword"
5510,WELLNESS,Almost Alcoholic: Could Your Drinking Be a Problem?
5511,FOOD & DRINK,How To Prepare Artichokes (VIDEOS)
5512,MONEY,"Few Things Are 100% Predictable\, But Here's One.."
5513,WELLNESS,Young Cancer Survivors Rarely Take Steps To Prevent Infertility
5514,HOME & LIVING,Craft Of The Day: Fabric-Covered Corkboard
5515,TRAVEL,Rick Steve's Road Trip: Atlanta's Naked Dogs And Peach Trees
5516,WELLNESS,Shrink Your Fat!
5517,FOOD & DRINK,How To Make DC Mumbo Sauce (Or Is It Really Chicago Mumbo Sauce?)
5518,WELLNESS,The Anatomy of a Healthy Sandwich
5519,TRAVEL,National Park Views Not To Be Missed (PHOTOS)
5520,WELLNESS,Vintage Weight Loss Ads: A Look At The Health Advice Of Yesteryear
5521,WELLNESS,On the To-Do List: Watch for Moments of Transcendence
5522,WELLNESS,How To Not Let Your Smartphone Take Over Your Attention And Life
5523,WELLNESS,3 Strategies To Calm Your Life Down
5524,WELLNESS,The Power Of Beginnings
5525,HOME & LIVING,12 Ways To Decorate With Colorful Flowers This Spring (PHOTOS)
5526,WELLNESS,Flu-Fighting Ability Could Lie In Person's Genes
5527,STYLE & BEAUTY,Sarah Jessica Parker's Style Evolution (PHOTOS)
5528,WEDDINGS,"Queen Drops In On Manchester Wedding\, Stuns Newlywed Couple"
5529,STYLE & BEAUTY,Model Alliance Working To Pass The Freelancer Payment Protection Act
5530,WELLNESS,"Blood Sugar Solution Challenge\, Day 27: Brown is Back! Lose Weight with Chocolate"
5531,STYLE & BEAUTY,Jennifer Lawrence 'IO Donna' Cover Is A Repeat! (PHOTOS)
5532,HOME & LIVING,Home Makeover: A Drab Loft Bedroom Gets A Very Stylish Update (VIDEO)
5533,WELLNESS,'Worthless' Foods That Are Actually Good for You
5534,WELLNESS,Pet Loss: What You Need To Know About Grief
5535,PARENTING,How Does She Do It?  10 Pieces Of Advice For Hectic Parents
5536,WELLNESS,"Going To Church Linked With Better Mood\, Study Finds"
5537,TRAVEL,10 Best American Cities For Cycling (PHOTOS)
5538,WELLNESS,6 Ways To Better Sleep
5539,TRAVEL,Bunny Chow Is For People!
5540,STYLE & BEAUTY,Jennifer Lawrence 'IO Donna' Cover Is A Repeat! (PHOTOS)
5541,WELLNESS,Why We Love To Be Haters (And What To Do About It)
5542,STYLE & BEAUTY,"Aristeo Tengco\, Emmanuel New York Models Founder\, Sued By Three Models"
5543,COMEDY,The Psychometer: Who Went Too Far Last Week?
5544,COMEDY,Whips & Harmonica Player Adam Winrich Ready For His Remix (VIDEO)
5545,COMEDY,"Jimmy Fallon's 'Thank You Notes': Tim Tebow\, Draw Something & Skinny Ties (VIDEO)"
5546,COMEDY,11 Awesome Fan-Made 'Star Wars' Lightsaber Duels (VIDEO)
5547,CRIME,"Bringing Florida to Justice\, Not Just George Zimmerman"
5548,CRIME,Tale of the Trayvon Martin Case 911 Calls
5549,BLACK VOICES,The Black Mother's Burden
5550,BLACK VOICES,"Trayvon Martin's Death Sparks A Familiar\, Fraught Conversation About Race And The Police"
5551,BLACK VOICES,'Black Love' Wedding Announcements: Matthew and Erica Paul (PHOTOS)
5552,BLACK VOICES,Jamillah And David Lamb Share 'Perfect Combination' To Happily Living And Loving Together
5553,BLACK VOICES,"Privilege and silence of white \beyond evangelicals\"""""
5554,BLACK VOICES,"Joe Oliver\, George Zimmerman's Friend\, Defends Shooter In Trayvon Martin Case"
5555,BLACK VOICES,Gates's 'Finding Your Roots' Is Beginning Its Fourth Season
5556,SCIENCE,Robot Submarine To Europa Could Find Aquatic Life On Jupiter's Icy Moon
5557,SCIENCE,Hidden Beauty in Turboencabulators
5558,SCIENCE,Hand-Held Robot Performs Prostate Surgery
5559,SCIENCE,Santorum Says Porn Causes Aggression But Scientists Disagree
5560,QUEER VOICES,20/20 Needs New Glasses: Tyler Clementi Segment Sensational and Simplistic
5561,QUEER VOICES,"Know Thine Enemy: The Worst Anti-LGBT Moments Of The Week\, March 18 - March 25"
5562,QUEER VOICES,GLAAD 2012 New York City Media Awards Winners Announced
5563,IMPACT,Doing What We Can to Help our Heroes and Their Families
5564,IMPACT,Notes on Slacktivism
5565,IMPACT,Prom Boutique Donates Dresses To Girls Who Can't Afford Them
5566,IMPACT,From Slactivism to Activism
5567,IMPACT,Accountability & Action: USAID's Counter-Trafficking Policy
5568,IMPACT,World Tuberculosis Day -- Do We Really Need It?
5569,ENVIRONMENT,Animal Photos Of The Week
5570,ENVIRONMENT,"Weather-Manmade Global Warming Link Builds\, Study Says"
5571,ENVIRONMENT,Dog Defends Food From Greedy Duck (VIDEO)
5572,ENVIRONMENT,Man Cuddles Lions In Zebra Colored Truck (VIDEO)
5573,ENVIRONMENT,Hatch Watch 2012: Decorah Eagles' Eggs Ready To Hatch
5574,ENVIRONMENT,San Diego Humane Society Shelter Shows How To Keep Rescues Comfortable
5575,BUSINESS,"After A Lifetime Of Hard Work\, The Indignity Of A Layoff"
5576,BUSINESS,Rich Won't Move Even If State Raises Income Taxes: Report
5577,BUSINESS,Ten Tips For Finding Work In A Tough Economy
5578,BUSINESS,"Joe Ratterman\, BATS CEO: IPO Debacle 'Completely Regrettable And Very Painful'"
5579,BUSINESS,"Obama's \All-Of-The Above\"" Oil/Energy Policy Misguidedly Leaves Much Off The Table"""
5580,BUSINESS,Belvedere Vodka Ad Under Fire For Rape Implications
5581,BUSINESS,Shell Struggling To Pay Off $1 Billion Bill To Iran With Sanctions In Place
5582,BUSINESS,"The Recession Is Over\, But This Huge Problem Is Not"
5583,BUSINESS,Paul Volcker: Obama Socialist Comments Have 'No Connection With Reality'
5584,BUSINESS,Ed DeMarco A Marked Man
5585,BUSINESS,Fast-Food Chains With The Most Unhealthy Customers: 24/7 Wall St.
5586,ENTERTAINMENT,Should the Bay Area Be Concerned That WonderCon Is Foresaking Frisco for Anaheim?
5587,ENTERTAINMENT,'The Hunger Games' Weekend Box Office: $155 Million
5588,ENTERTAINMENT,Madonna At Ultra: Pop Icon Makes Surprise Appearance At Electronic Dance Music Festival (VIDEO)
5589,CULTURE & ARTS,"Wang Jun\, Artist\, Spends One Month On A Scale To Lose Weight"
5590,CULTURE & ARTS,"Happy 45th Birthday\, Matthew Barney!"
5591,TECH,iPad Black Market Falls On Tough Times
5592,TECH,"Yahoo\, Third Point Square Off For Proxy Fight Despite Three New Independent Board Directors"
5593,TECH,How to Control Facebook App Privacy (VIDEO)
5594,TECH,'Cash Mobs' Use Social Media To Splurge In Locally Owned Stores
5595,TECH,Instagram Android Signup Page Starts Accepting Registration Requests (PICTURE)
5596,TECH,Watch The Top 9 YouTube Videos Of The Week
5597,TECH,"This Week In Apple Rumors: iPhone 5 Display Size\, Retina Display Macs\, And Foxconn's Hiring Spree"
5598,TECH,Microsoft Allegedly Censors Pirate Bay Links In Windows Live Messenger
5599,DIVORCE,Divorce: The Exchange of Intimacy for Absence?
5600,WELLNESS,'We Can Do Better': Finding The Right Solutions In The Diabetes Epidemic
5601,WELLNESS,10 Ways To Beat Cat Allergies
5602,TRAVEL,The Arctic: A Journey Of Epic Proportions
5603,WELLNESS,"Anais Fournier\, 14-Year-Old Girl\, Dies After Drinking 2 Energy Drinks"
5604,TRAVEL,5 Great Affordable Beach Resorts (PHOTOS)
5605,WELLNESS,Self-Dissolving Tinnitus Treatment Gives New Hope For Hearing Condition
5606,WELLNESS,"Teachers Are Students\, Too"
5607,TRAVEL,Paris Breakfasts: In Two New Hotels And A Department Store
5608,STYLE & BEAUTY,Elizabeth And James Show Pajamas For Fall: From The Stylelist Network
5609,STYLE & BEAUTY,Swapping Spring Wardrobes: From The Stylelist Network's 'My Style Pill'
5610,WELLNESS,Spring Training for Non-Athletes
5611,STYLE & BEAUTY,"Models In Bikinis: Doutzen Kroes\, Anne V. & Irina Shayk Hit The Miami Beaches! (PHOTOS)"
5612,STYLE & BEAUTY,'Mad Men' Stars Before Fame (PHOTOS)
5613,WELLNESS,"Viewing Heart Damage Can Make People Serious About Statins\, Study Shows"
5614,STYLE & BEAUTY,Alyson Hannigan's Style Evolution (PHOTOS)
5615,WELLNESS,World Tuberculosis Day 2012: Stopping Tuberculosis in Our Lifetimes
5616,HOME & LIVING,Weekend DIY Projects: 10 Ways To Fix Up Your Home In 2 Days Or Less (PHOTOS)
5617,WELLNESS,Spring Cleaning: 11 Germ Traps To Clean Today
5618,WELLNESS,6 Surprising Sleep Stealers
5619,WELLNESS,"Math Anxiety Linked With Differences In Brain Functioning\, Study Finds"
5620,STYLE & BEAUTY,Vintage Shopping At Shareen's In Los Angeles: From The Stylelist Network's 'Karla's Closet'
5621,STYLE & BEAUTY,Milkshake Argan Oil Review: From The Stylelist Network's 'Assignment Fashion'
5622,STYLE & BEAUTY,Most Dangerous Fashion And Beauty Items
5623,WEDDINGS,Why Black Marriage Day?
5624,STYLE & BEAUTY,"Nicki Minaj\, Katy Perry\, Snooki and More Fashion Flops This Week (PHOTOS)"
5625,HOME & LIVING,"In Honor Of 'Mad Men' Season Five\, Here's A 60s Cocktail Party Plan"
5626,WELLNESS,Be Willing To Dream: Choosing A Life Of Greatness
5627,MONEY,Who Are America's 6 Richest Women?
5628,WEDDINGS,"10 Ways To Celebrate Green: Wedding Planning\, Purchasing\, And Partying"
5629,STYLE & BEAUTY,Fashionably Late: Style News You Might Have Missed This Week (PHOTOS)
5630,TRAVEL,Finding The Bear Capital Of America (VIDEO)
5631,WELLNESS,Measles: Back to the Future of Public Health?
5632,COMEDY,SXSW 2012 Comedy: HuffPost Comedy's Recap And Final Thoughts
5633,COMEDY,"Pug Gets Punished\, Sneaks Away In Shame (VIDEO)"
5634,COMEDY,The Best Late Night Clips of the Week (VIDEO/PHOTOS)
5635,COMEDY,"Bill Maher Rips Media 'Conniption Fits\,' Calls Mitt Romney 'The Least Interesting Man In The World' (VIDEO)"
5636,CRIME,Milan Jurisic Killed And Eaten Allegedly By Serbian Mafia Members From Zemun Clan
5637,CRIME,Hailey Dunn Update: Remains Found Aren't Missing Texas Cheerleader
5638,CRIME,"What Does Trayvon Martin and Sanford\, Fla. Say About Our Nation Today?"
5639,BLACK VOICES,Running From Race in Our Minds
5640,BLACK VOICES,"Craig Sonner\, George Zimmerman's Lawyer\, Says Client Is Not Racist During CNN Interview"
5641,BLACK VOICES,Trayvon Martin Case: Florida Man Arrested For Threatening To Kill Police Chief Bill Lee And His Family
5642,SCIENCE,Space Junk Forces ISS Astronauts to Take Shelter in 'Lifeboat' Capsules
5643,SCIENCE,"Exoplanets Can Zoom From Galaxy At 'Warp Speed\,' Study Shows"
5644,SCIENCE,'Hunger Games' Exposes Myth of Technological Progress
5645,QUEER VOICES,Translating Hate
5646,QUEER VOICES,Trayvon Martin's Death: A Moment of Dissonance
5647,QUEER VOICES,"'Testimony\,' Musical 'It Gets Better' Anthem Performed By San Francisco Gay Men's Chorus\, Goes Viral"
5648,QUEER VOICES,Top 20 Sexiest Male Musicians Of All Time: The Complete List
5649,QUEER VOICES,"Mel Wymore\, Transgender Man\, Runs For New York City Council"
5650,ENVIRONMENT,Is Walking A Form Of Activism?
5651,ENVIRONMENT,"Natural Gas Wells Proliferation Poisoning Children's Air\, Research Suggests"
5652,ENVIRONMENT,Exxon Valdez Oil Spill a Cautionary Tale for Arctic Ocean Drilling
5653,ENVIRONMENT,Extreme Weather Of The Week (PHOTOS)
5654,ENVIRONMENT,"Spring Weather 2012: If Spring Came Early\, What Will Summer Feel Like?"
5655,ENVIRONMENT,"Coiba\, Panama: Mission Blue Final Thoughts And Goodbye (PHOTOS)"
5656,BUSINESS,"JCore\, Wall Street Exercise Regimen\, Makes For Hilarious TV (WATCH)"
5657,BUSINESS,Greg Smith Book Deal? Former Goldman Sachs Executive Who Wrote Scathing New York Times Column Reportedly Meets With Publishers
5658,BUSINESS,"Jon Corzine\, Ex-MF Global CEO\, Stands By Previous Testimony"
5659,ENTERTAINMENT,"'The Hunger Games\,' Madonna's 'MDNA\,' 'Bent' And More: The Week In Ouch"
5660,ENTERTAINMENT,'Zoolander': Ben Stiller Snaps Photo Of Owen Wilson Meeting Malaysian Prime Minister
5661,ENTERTAINMENT,'Hunger Games' Box Office: Movie Grosses $155 Million; Third Highest Opening Of All Time (UPDATE)
5662,ENTERTAINMENT,"'Jersey Shore' Phasing Out Snooki\, The Situation: REPORT"
5663,ENTERTAINMENT,"'Carrie' Remake: Chloe Grace Moretz\, Haley Bennett In The Running For Lead Role"
5664,CULTURE & ARTS,"\Voices Of Light\"" Channels Joan Of Arc At Berkeley's Zellerbach Hall (PHOTOS)"""
5665,CULTURE & ARTS,Dario Escobar Makes Objects Go Pop
5666,CULTURE & ARTS,"Week In Art: WPA Color Photos\, Van Gogh X-Rayed\, And Salt Labyrinths"
5667,TECH,Fingerprint-Checking Smartphone Patent Filed By Sony
5668,TECH,Facebook Tightens Hold On 'Book' Trademark With Slight User Agreement Tweak
5669,TECH,Can You Hear Me Now?
5670,TECH,Memo to Small Business: RingCentral Will Take Your Calls
5671,SPORTS,"North Carolina Survives Ohio Scare\, but Deeply Misses Kendall Marshall"
5672,SPORTS,Penn State Police Had Warnings About Sandusky In 1998
5673,PARENTING,Parents Who Let Their Children Dress Sexy
5674,WEDDINGS,5 Skin Tactics Every Engaged Girl Should Be Using
5675,DIVORCE,How To Teach People Not To Marry The Wrong Person
5676,PARENTING,Pregnant Over 40: I Think I'm Going to Eat My Placenta
5677,TRAVEL,"A Young Surfer Leaves NorCal\, Wreaks Havoc In San Diego"
5678,PARENTING,Why Are We Feeding Our Kids So Much Junk?
5679,PARENTING,"Dear Drug Dealer\, I Just Might Be Serious\, Love a Mom"
