ID,category,description
2798,STYLE & BEAUTY,"Dakota Johnson\, Melanie Griffith's Daughter\, Stars In Oliver Peoples New Campaign (PHOTOS)"
2799,PARENTING,"Pinkstinks\, U.K. Organization\, Aims To Stop The Marketing Of Makeup To Pre-Preteens"
2800,STYLE & BEAUTY,Weekly Roundup of eBay Vintage Clothing Finds (PHOTOS)
2801,WEDDINGS,Moving Forward: Thoughts On A Parent's Remarriage
2802,HOME & LIVING,CustomMade Curator: A Very Eccentric 'Spacewhip' Bench
2803,PARENTING,"Elisabeth Badinter\, Author Of 'The Conflict' On What's Holding Mothers Back"
2804,DIVORCE,Divorce Stories: Twitter And Facebook Users Reveal The Craziest Thing They Did Post-Split
2805,PARENTING,"To Allow Facebook or Not to Allow Facebook\, that is the Question"
2806,WEDDINGS,10 Things You Should Never Say To Your Stationer
2807,WEDDINGS,Angelina Jolie's Engagement Ring: Designer Robert Procop Talks to HuffPost
2808,TRAVEL,What A US Airways & American Airlines Merger Would Mean For You
2809,WELLNESS,How's Your Existential Maturity?
2810,PARENTING,That's What Friends Are For
2811,WEDDINGS,Reasons To Get Married: Is Marriage A Form Of Peer Pressure?
2812,FOOD & DRINK,Cookware Guide: The Best (And Worst) Materials For Pots And Pans
2813,PARENTING,A Philosopher's Case Against Modern Motherhood
2814,FOOD & DRINK,Cereal Cooking: Chefs Find Inspiration In Sugary Breakfast Food (PHOTOS)
2815,DIVORCE,The Four Divorce Alternatives
2816,WELLNESS,Dick Clark Had Routine Prostate Surgery The Day Before His Death
2817,DIVORCE,"Was Einstein The World's Worst Husband? Wife Ordered To Keep Room Tidy\, Serve Three Meals A Day - But Expect NO Affection... And She Must Stop Talking When He Demands It"
2818,WEDDINGS,A Wedding Planner's Top 12 Pet Peeves
2819,WELLNESS,A Happy World Begins With a Happy You
2820,HOME & LIVING,How Much Would You Pay For The Philips 20-Year LED Lightbulb?
2821,WELLNESS,"PSA Screening Guidelines Ignored By Many Men\, Study Shows"
2822,DIVORCE,Liza Minnelli: 'Hit Me Over The Head' If You Hear I'm Getting Married Again
2823,MONEY,College Financial Aid Letters Deceive Prospective Students
2824,WEDDINGS,Wedding Cake: Bride Wonders If Every Wedding Needs A Cake
2825,WEDDINGS,6 Ways To Stay Sane While Planning Your Wedding
2826,TRAVEL,Going Home: The Rabbi's Daughter Finally Makes It To Israel (PHOTOS)
2827,WELLNESS,Plyometrics Workout: Add Some Spring To Your Step
2828,WELLNESS,How to Have a Colonoscopy
2829,WELLNESS,Weight Loss Success: Jacquelyn Taylor Made Over Her Way Of Life And Lost 70 Pounds
2830,PARENTING,My Kids Want a Dog. Do I?
2831,WELLNESS,"Feeding Tube Diet: Shut Up\, and Eat"
2832,PARENTING,5 Ways to Teach Toddlers Table Manners
2833,WELLNESS,Day 7: Eat Lower on the Glycemic Index
2834,STYLE & BEAUTY,House Tour: 'Swank Heights' Blogger Invites Us Into Her Budget-Friendly Bedroom (PHOTOS)
2835,WELLNESS,Does Love Have to Be Choosy?
2836,STYLE & BEAUTY,Calista Flockhart's '90s Corporate Style: Ready For A Comeback?
2837,WELLNESS,When Your Mom Forgets Who You Are
2838,STYLE & BEAUTY,"Beauty Street Style: Laura Selfridge\, Student\, Makes Her Hair Grow Faster With This"
2839,WELLNESS,State Life Expectancy: Report Details Gains And Losses In Life Expectancy Around The Country
2840,TRAVEL,5 Dive Spots In Unexpected Places Around The World (PHOTOS)
2841,WELLNESS,"Burger King: Salad\, Smoothies And 'Healthier' New Menu"
2842,WELLNESS,Autism Treatments Called Into Question
2843,HOME & LIVING,Design Ideas: A Small Bedroom Gets A Space-Maximizing Makeover (VIDEO)
2844,PARENTING,The Journey to Labor Land: How Women Can Reclaim Their Birth Rights
2845,STYLE & BEAUTY,"Coachella Fashion 2012: Emma Roberts\, Kristin Stewart\, Zoe Kravitz And More Star Style (PHOTOS)"
2846,MONEY,TSA Keeps The Spare Change You Leave Behind At Airport Security
2847,STYLE & BEAUTY,Natalia Vodianova: 'It's Better To Be Skinny Than To Be Fat' (UPDATED)
2848,PARENTING,Mom Resurrects a Childlike Dream
2849,PARENTING,Parenthesis: The Best of the Parenting Blogosphere
2850,WELLNESS,"Colorectal Cancer: Robin Gibb\, Bee Gees Singer\, Dies After Battling The Disease (UPDATED)"
2851,STYLE & BEAUTY,Abbey Lee Kershaw Movie Debut On The Way (PHOTOS)
2852,STYLE & BEAUTY,Alessandra Ambrosio Poses Nude & Pregnant For Vivara Jewelry Ad (PHOTO)
2853,STYLE & BEAUTY,Veroniek For 'Harper's Bazaar Singapore' Looks Like A Kim Kardashian Barbie (PHOTO)
2854,STYLE & BEAUTY,"Harper Beckham Converse Sneakers Are Adorable\, So Un-Posh Like (PHOTOS)"
2855,MONEY,How To Avoid A Debt Collector Nightmare
2856,TRAVEL,Man Proposes On Megabus (VIDEO)
2857,WELLNESS,Metta World Peace (Formerly Ron Artest) And Other Athletes Who Face Mental Health Struggles
2858,STYLE & BEAUTY,The 7 Most Flattering Swimsuits For Women: Which Look Is For You? (PHOTOS)
2859,STYLE & BEAUTY,"Sean Penn\, Petra Nemcova Dating? Model & Actor Reportedly Reunite"
2860,WELLNESS,45 Healthy Foods To Make And Never Buy Again
2861,STYLE & BEAUTY,Dancing With The Stars' Cheryl Burke Talks Spray Tanning With Allure (PHOTOS)
2862,DIVORCE,10 Signs You May Be In An Emotionally Abusive Relationship
2863,MONEY,Make Every Month Financial Literacy Month
2864,WEDDINGS,"Chelsea Handler's Boyfriend\, Andre Balazs\, Might Not Be Future Husband\, Comedian Says"
2865,PARENTING,How My Son Teaches Me About Money
2866,MONEY,Abraham Lincoln's Opera Glasses Up For Auction
2867,PARENTING,The Real Cry: A Daughter's Expression Evolves
2868,DIVORCE,'Divorce Is': Tweeters Share Their Definitions
2869,WEDDINGS,10 Things You Should Never Say To Your Stationer
2870,PARENTING,"Jabba is Dead\, or My Daughters Watch Return of the Jedi"
2871,WEDDINGS,Marriage Quotes: Which Celebrity Said This Quote About Their Marriage?
2872,PARENTING,What Makes a Terrific Parent?
2873,FOOD & DRINK,5 Family-Friendly Weeknight Dinners
2874,PARENTING,"Parenting 2.0: Raising A Compassionate\, Innovative Citizen Of The World\, Not The 'Next Steve Jobs"
2875,PARENTING,Fanfare for an Uncommon Man
2876,PARENTING,My Seven-Month-Old Potty Pooper
2877,STYLE & BEAUTY,Dita Von Teese In A Colorful Jumpsuit: Look Of The Day
2878,STYLE & BEAUTY,This Week on Etsy: 6 Smart Gifts for Mother's Day
2879,STYLE & BEAUTY,How To Wear Wide-Leg Pants: From The Styleist Network
2880,STYLE & BEAUTY,Cute Kate Spade Clutches: From The Stylelist Network
2881,STYLE & BEAUTY,Claire Geist's Playlist: From The Stylelist Network
2882,WELLNESS,Giuliana Rancic Expecting A Baby Via Surrogate: Is Pregnancy Dangerous After Cancer?
2883,WELLNESS,Migraine Relief: New Guidelines Highlight Natural Options
2884,WELLNESS,"Life\, Death\, and the Space in Between"
2885,HOME & LIVING,Spring Cleaning: An Easy Way To Remove Ink Stains On Leather
2886,DIVORCE,"Scrub a Dub Dub\, There's an Ex in My Tub"
2887,WELLNESS,8 Celebrities Touched By Lyme Disease
2888,WELLNESS,One Good Way to Kick a Bad Habit
2889,TRAVEL,Thank You Somali Pirates For This Fascinating Vacation (PHOTOS)
2890,TRAVEL,Top Celebrity-Owned Hotels (PHOTOS)
2891,PARENTING,"Ten Things We Should Teach Kids\, but Don't"
2892,TRAVEL,Dateline Thailand: Day 10 Of The Global Scavenger Hunt
2893,PARENTING,All Is Fair in Love and Mommy Wars
2894,TRAVEL,"Shakespeare\, Woody Allen And A Certain Qantas A380"
2895,TRAVEL,Borat Still Boosting Kazakhstan Tourism
2896,FOOD & DRINK,Totally Awesome Cake Batter Fudge
2897,STYLE & BEAUTY,"One Month\, Six Pieces of Clothing: Taking on the Six-Item Challenge"
2898,STYLE & BEAUTY,"Mad Men Season 5\, Episode 6 Style Recap"
2899,PARENTING,Parent Diet Choice Knowledge Doesn't Prevent Child Obesity
2900,WELLNESS,Sam Simon And 12 Other Celebrities Touched By Colorectal Cancer
2901,HOME & LIVING,Etsy DIY Ideas: A Charming Bird Mobile You Can Make (VIDEO)
2902,WELLNESS,"Too Much Free Time Could Make Us Feel Too Busy\, Study Suggests"
2903,PARENTING,"Frans Hofmeester\, Filmmaker\, Films Daughter For 12 Years\, Makes Time-Lapse Video"
2904,STYLE & BEAUTY,My Hot Babe Makeover
2905,PARENTING,Little White Lies Moms Tell Their Babysitters
2906,TRAVEL,"US Travel Industry\, Rosanne Cash Launch First 'Discover America' Ad Campaign"
2907,MONEY,Craigslist Scams: Tips To Avoid Losing Money
2908,STYLE & BEAUTY,"Dewar's Scotch Whisky Honors Dynamic \Double Act\"" Behind Rag & Bone"""
2909,WELLNESS,5 Causes of Loneliness
2910,HOME & LIVING,Craft Of The Day: Framed Key Art
2911,WELLNESS,The K-E Diet: Weight Loss Lunacy
2912,STYLE & BEAUTY,"The 80s Fashion Staple That Will Take Inches Off Your Waist\, Made Modern (PHOTOS)"
2913,TRAVEL,A Serene Hideaway On Brazil's Green Coast
2914,FOOD & DRINK,"Coffee Dessert Recipes: Cakes\, Brownies And More"
2915,WELLNESS,Pat Summitt's Candor Is a 'Win' for Young-Onset Alzheimer's Disease
2916,WELLNESS,When Wishes Are Fishes
2917,FOOD & DRINK,Ricotta Recipes To Make All Year Long
2918,MONEY,Teaching Children the Value of a Dollar in a Debt-Filled World
2919,STYLE & BEAUTY,"Hot High Heels: 7 Pairs Of Stylish\, Sexy Shoes You Have To See (PHOTOS)"
2920,FOOD & DRINK,How To Make Dulce De Leche
2921,STYLE & BEAUTY,DIY Nail Art: Inkblot-Inspired Manicure
2922,DIVORCE,Top 5 Ways to Ensure Financial Security During your Divorce
2923,STYLE & BEAUTY,DIY Nail Ideas: The 'Best' Nail Polish Color For Brunettes And More Of Our Weekend Manicures (PHOTOS)
2924,WELLNESS,Lose the Last 10 Pounds by Memorial Day Weekend
2925,WELLNESS,Weight Loss Tips: Willpower Secrets From The Pros
2926,PARENTING,Pets And Babies: Lessons From Dogs And Cats For Kids [PHOTOS]
2927,WELLNESS,"Walking Could Help To Decrease Depression\, Review Finds"
2928,WELLNESS,Weight Loss: What's the Point?
2929,PARENTING,So What If Our Child Has 87 Siblings?
2930,TRAVEL,Finding A Happy Place With The Help Of Statistics (PHOTOS)
2931,TRAVEL,Pardon My French: Our Heroine Gets To Know The Neighborhood
2932,WELLNESS,Day 6: Blend Up a Power Smoothie
2933,TRAVEL,Cape Town's Stunning Beauty And Deep History
2934,WELLNESS,5 Myths About Vitamins
2935,TRAVEL,Explore America: Nebraska's Prairie 'Chickens And Stars' Event (PHOTOS)
2936,STYLE & BEAUTY,"This Week In Beauty: The Best & Worst From April 15-22\, 2012 (PHOTOS)"
2937,STYLE & BEAUTY,Marisa Tomei Does Grown-Up Florals In A Preen Dress: Look Of The Day
2938,TRAVEL,New U.S. Literary Tourism Goes Beyond 'The Hunger Games'
2939,STYLE & BEAUTY,Abbey Lee Kershaw Movie Debut On The Way (PHOTOS)
2940,STYLE & BEAUTY,"Valeria Lukyanova Is A Real-Life Barbie Doll (PHOTOS\, VIDEOS)"
2941,STYLE & BEAUTY,Valeria Lukyanova Is A Real-Life Barbie Doll (VIDEOS)
2942,STYLE & BEAUTY,"Jennifer Connelly Blonde For New Movie\, 'Virginia' (WATCH)"
2943,STYLE & BEAUTY,"Cybill Shepherd's Polka-Dot Tie\, 1971: A Look Back"
2944,STYLE & BEAUTY,"American Idol: What They Wore\, 4/18/12 (Top 7 Redux)"
2945,PARENTING,A Mom's Wish
2946,HOME & LIVING,Designer Richard Mishaan's Dreamy Family Home In Colombia In Architectural Digest (PHOTOS)
2947,STYLE & BEAUTY,William & Kate Running The London Marathon? (VIDEO)
2948,STYLE & BEAUTY,"Jennifer Connelly Blonde For New Movie\, 'Virginia' (WATCH)"
2949,WELLNESS,Miss Wisconsin Talks About Growing Up WIth Addiction
2950,WELLNESS,When Do You Practice What You Preach?
2951,PARENTING,Celebrate Earth Day By Stargazing With Your Kids
2952,WELLNESS,10 Beliefs That May Be Keeping You From the Life You Want
2953,WELLNESS,Earth Day / Earth Night: How Green Is Your Sleep?
2954,STYLE & BEAUTY,'So You Think You Can Dance' Host Cat Deeley Has Major Style (PHOTOS)
2955,STYLE & BEAUTY,Earth Day 2012: Fashion's Most Eco-Friendly Models & Designers (PHOTOS)
2956,WELLNESS,Sleeping On The Job? Good! Overachievers Do
2957,COMEDY,Baby Cleans Up Like Nobody's Business (VIDEO)
2958,COMEDY,Paul F. Tompkins Dishes On 'Best Week Ever' (VIDEO)
2959,COMEDY,Earth Day 2012: The Funniest Tweets (SLIDESHOW)
2960,COMEDY,Nazi Cat: Adorable Kitty Keeps Making Offensive Gesture (VIDEO)
2961,BLACK VOICES,"Talk that Talk\, Honey!"
2962,BLACK VOICES,Standing for Sybrina Fulton on Mother's Day
2963,BLACK VOICES,For Sybrina: Show Your Support And Share Your Mother's Day Wishes For Trayvon Martin's Mother (UPDATE)
2964,BLACK VOICES,Michael Ealy: The Bounty Scandal Is Devastating For New Orleans: Love Of The Game
2965,BLACK VOICES,Tropical Foodies: What To Eat In An Ethiopian Restaurant
2966,BLACK VOICES,Earth Day: Our Favorite Eco-Friendly Beauty Brands (PHOTOS)
2967,SCIENCE,Nuthin' to Explain
2968,SCIENCE,Gene Screens for Soldiers
2969,SCIENCE,Cell Phone Study Suggests Female Relationships Shape Society
2970,SCIENCE,"Jupiter Sky Show Ends April 22\, With Planet 'Returning' In June"
2971,SCIENCE,"Face's Left Side More Attractive Than Its Right Side\, Study Shows"
2972,QUEER VOICES,"Jennifer Tyrrell\, Boy Scouts Den Mother Ousted For Being A Lesbian: 'I Was Accepted By All'"
2973,QUEER VOICES,"Kenneth Weishuhn\, Gay Iowa Teen\, Suicide Inspires Anti-Bullying Vigil"
2974,IMPACT,From Environmentalism to Regeneration: What We Need to Do Differently This Earth Day
2975,IMPACT,Every Child Deserves A 5th Birthday
2976,IMPACT,Going Up
2977,IMPACT,Good Work in the Private Sector
2978,IMPACT,Senior Volunteer Honorees Make Communities Better
2979,IMPACT,Earth Day 2012: How You Can Help Save Our Planet's Resources
2980,ENVIRONMENT,"Earth Day 2012: United We Stand\, Divided We Fall"
2981,ENVIRONMENT,Earth Day 2012 Environmental Issues: Recycling Waste
2982,ENVIRONMENT,Reflections on Earth Day
2983,ENVIRONMENT,When It Hits Home...
2984,ENVIRONMENT,Nothing Is Immune to the Ocean
2985,ENVIRONMENT,Life As a Climate Refugee
2986,ENVIRONMENT,Climate Victim
2987,ENVIRONMENT,Happy Earth Day? A Sneak Attack on the Wilderness Act
2988,ENVIRONMENT,'Hidden Water' Video Highlights Water Conservation Issues
2989,ENVIRONMENT,"The Climate Post: As Half the U.S. Contemplates Hydraulic Fracturing\, First Liquefied Natural Gas Export Plant Approved"
2990,ENVIRONMENT,Best Green Books: The Top 10 Environmental Reads For Earth Day 2012
2991,ENVIRONMENT,Act Different
2992,ENVIRONMENT,Earth Week 2012 Challenges: Waste Less Water
2993,ENVIRONMENT,Earth Day 2012: Successes Since The Beginning Of The Movement
2994,ENVIRONMENT,"Earth Day\, Conspiracy and World Government"
2995,ENVIRONMENT,"Amy Goodman: The Long\, Hot March Of Climate Change"
2996,ENVIRONMENT,Endangered Animal Photos For Earth Day
2997,ENVIRONMENT,Defining Green Wine
2998,ENVIRONMENT,It's Climate Change That Threatens Our Way of Life -- Not the Actions We Need to Take to Solve It
2999,ENVIRONMENT,The Fukushima Nuclear Disaster Is Far From Over
3000,BUSINESS,Why The Euro Isn't Worth Saving
3001,BUSINESS,The Ten Most (And Least) Affordable Cities To Buy A Home: 24/7 Wall St.
3002,BUSINESS,Infosys Controversy: Homeland Security Investigates Indian Software Giant
3003,ENTERTAINMENT,Rolling Stones Movie: Virgin Buys Rights To 'Exile on Main Street' Book
3004,ENTERTAINMENT,"On His 75th Birthday\, The Best Jack Nicholson Movies of All Time"
3005,ENTERTAINMENT,"Susan Sarandon Says White House Denied Security Clearance\, Interviews Michael Moore"
3006,ENTERTAINMENT,The Free Space
3007,ENTERTAINMENT,Johnny Depp Talks 'The Lone Ranger' Make-Up As Tonto
3008,ENTERTAINMENT,Dr. John and Soul Fire for the Gulf
3009,CULTURE & ARTS,Valerie Hegarty's 'Altered States' At Marlborough Gallery Makes Deterioration Look Good (PHOTOS)
3010,CULTURE & ARTS,"'Gender in Izolyatsia' Explores Identity In Ukraine (PHOTOS\, NSFW)"
3011,TECH,Watch The Top 9 YouTube Videos Of The Week
3012,TECH,Earth Day 2012: Google Logo Blossoms With Gorgeous Flowers
3013,WELLNESS,In Defense of Fat: 7 Surprising Facts
3014,WELLNESS,The Health Benefits Of Having A Dog
3015,WEDDINGS,"Guests Can Now Wear White to Weddings\, Emily Post Turns Over in Grave"
3016,TRAVEL,National Parks Week: The Best Viral Videos Of America's Parks (VIDEO)
3017,WELLNESS,The Lesson of a Leaf
3018,WELLNESS,Day 5: Put a Little Flax on it
3019,STYLE & BEAUTY,Monica Bellucci Stuns In Her Red Hot Dress: A Look Back
3020,WELLNESS,To Health With Fun? Bring on the Epidemic!
3021,TRAVEL,A Northern Indian Road Trip Becomes A Cultural Buffet
3022,HOME & LIVING,Weekend DIY: 8 Ways To Fix Up Your Home In 2 Days Or Less (PHOTOS)
3023,WELLNESS,"Full Cup\, Thirsty Spirit: Meditating with Dinosaurs... Really?"
3024,TRAVEL,Best Kids' Cruise? Disney Or NCL (VIDEO)
3025,TRAVEL,America's Best Rooftop Bars (PHOTOS)
3026,TRAVEL,National Park Week: How To Avoid The Crowds
3027,STYLE & BEAUTY,Brooklyn Decker Makes Casual Cute In A T-Shirt And Sneakers: Look Of The Day
3028,STYLE & BEAUTY,Queen Elizabeth II Birthday: The Monarch Turns 86! (PHOTOS)
3029,DIVORCE,Why Men Should Take A Lesson From Women On Cheating
3030,DIVORCE,Should I Stay Or Go?
3031,MONEY,Being a Good Financial Role Model
3032,WELLNESS,"Drug Safety Tracked Even After Approval\, FDA Says"
3033,TRAVEL,10 Green Hotels To Book For Earth Day (PHOTOS)
3034,STYLE & BEAUTY,Gisele Bündchen's 5-Year-Old Niece: Model And Designer Duda Bündchen
3035,WELLNESS,"Daily Chores And Exercise Could Help Ward Off Alzheimer's\, Study Suggests"
3036,PARENTING,Table Talk: What Can You Do To Celebrate Earth Day?
3037,HOME & LIVING,Hot On Pinterest: An Elegant Jar Candle
3038,STYLE & BEAUTY,Fashionably Late Style Quiz: A Test On All The Style News You Might Have Missed This Week
3039,WELLNESS,When I Look at Relationships
3040,WEDDINGS,Royal Anniversary: 9 Bizarre Items Celebrating Prince William And Kate Middleton's Big Day
3041,STYLE & BEAUTY,Earth Day 2012: A List Of NOT So Eco-Friendly Style Icons (PHOTOS)
3042,COMEDY,The Funniest Someecards Of The Week (PICTURES)
3043,COMEDY,Singing Dog Plays Piano (VIDEO)
3044,COMEDY,Bill Maher Blasts Republicans Over Pink Slime (VIDEO)
3045,COMEDY,Escalator FAIL: Boy Attempts To Ride Escalator Handrail (VIDEO)
3046,COMEDY,How to Write an Opinion Piece About Girls
3047,SCIENCE,Science Needs Nonpartisan Advocates
3048,SCIENCE,"Salem Witch Trials Followed Cold Weather\, New Research Finds"
3049,QUEER VOICES,Words
3050,QUEER VOICES,'Gender Confirmation Surgery': What's in a Name?
3051,QUEER VOICES,Queeries: Should You Come Out As Tattooed?
3052,QUEER VOICES,AfterEllen.com's Best Lesbian Week Ever: April 14-20
3053,QUEER VOICES,17 Of The Worst Anti-LGBT Moments Of The Week April 16 - April 21
3054,QUEER VOICES,Chris Evans On Gay Marriage: 'In 10 Years We'll Be Ashamed That This Was An Issue'
3055,QUEER VOICES,Nepal's Sunil Pant Keeps His Country at the Forefront of LGBT Rights
3056,IMPACT,Volunteerism: A Way of Life and a Career
3057,IMPACT,Matt Damon To The Atlantic: 'I Would Kiss George W. Bush On The Mouth' For His AIDS Work
3058,IMPACT,"Community and the Death of my Good Friend\, Tersh Murdoch"
3059,ENVIRONMENT,"Winter Slade\, 7-Year-Old\, Raises Thousands For Wildlife Preservation After Being Told Her Idea Was 'Stupid'"
3060,ENVIRONMENT,Earth Day 2012: Time to Take the Lead
3061,ENVIRONMENT,Panda Cam: Explore.org Launches Live HD Video Of Giant Panda Bear Cubs For Earth Day (LIVE VIDEO)
3062,ENVIRONMENT,Earth Day 2012: Events Around The World
3063,ENVIRONMENT,Green Festival NYC 2012: Live Video From Sustainability Event In New York
3064,ENVIRONMENT,What's Changed About Deepwater Drilling Since Macondo? Not a Lot.
3065,ENVIRONMENT,"Earth Day 2012: This Isn't About Tree-Hugging Anymore\, It's About The Way We Live"
3066,ENVIRONMENT,Earth Week 2012 Challenges: Second-Hand Clothes And Products
3067,BUSINESS,Eight Products The Facebook Generation Will Not Buy: 24/7 Wall St.
3068,BUSINESS,In Economists We Trust
3069,BUSINESS,Warren Buffett Cancer Treatment Shows Challenges In Health Care Cost-Cutting
3070,BUSINESS,INET Video Series: Re-Examining Research on Financial Economics
3071,BUSINESS,Too Bigger To Fail
3072,BUSINESS,Explaining The Tax Code's Unfairness
3073,ENTERTAINMENT,'Booker's Place': Exploring the South's Troubled Legacy of Race
3074,ENTERTAINMENT,Tribeca 2012 Diary: Headshot Director Pen-ek Ratanaruang
3075,ENTERTAINMENT,"'The Lucky One\,' 'Girls\,' 'Think Like A Man' And More Bad Reviews: The Week In Ouch"
3076,ENTERTAINMENT,Not Loving Like
3077,ENTERTAINMENT,Yossi Looks at a Closeted Gay Man in Israeli Society
3078,CULTURE & ARTS,The Magic of Mamma Mia!
3079,CULTURE & ARTS,"Stage Door: One Man\, Two Guvnors\, End of the Rainbow"
3080,CULTURE & ARTS,"The Week In Art: Bob Marley\, Twin Peaks And My Meaty Pony"
3081,CULTURE & ARTS,Brandon Ballengée's 'Collapse: the Cry of Silent Forms' At Ronald Feldman Gallery (PHOTOS)
3082,CULTURE & ARTS,"\Archizines + Arch-Art! Books\"" Comes To Storefront For Art And Architecture (PHOTOS)"""
3083,CULTURE & ARTS,Katharina Wulff's Whimsical Mysteries Hit San Francisco Museum Of Modern Art (PHOTOS)
3084,TECH,"James Cameron\, Google's Eric Schmidt And Larry Page Back Space Exploration Project"
3085,TECH,Is NYC Beating DC in Tech?
3086,TECH,"Tao Girls: Taobao\, Chinese Shopping Site\, To Offer Model Delivery Service"
3087,WELLNESS,Please Meditate: Need More Brain? (VIDEO)
3088,PARENTING,Who's Your Daddy? Paternity Testing and the Nature of Fatherhood
3089,TRAVEL,Discovering The Mysterious Charms Of Azerbaijan (PHOTOS)
3090,DIVORCE,Chinese Woman Wants Out of Marriage and Motherhood
3091,WELLNESS,Weight Loss Success: Ashley Watts Wanted To Have Energy To Play With Her Kids And Lost 100 Pounds
3092,STYLE & BEAUTY,Prom Updos: 6 Steps To The Most-Requested Hairstyle (VIDEO)
3093,PARENTING,You've Put Your Kids on Psychiatric Meds -- Now What?
3094,WEDDINGS,I Cheated On My Husband With Christian Grey
3095,WELLNESS,How to Be the Healthiest Person Alive
3096,WELLNESS,Habits Are Everything
3097,WELLNESS,"Want To Change Your Life? Don't Get Involved\, Get Committed"
3098,PARENTING,I Know How He Does It: Parenting From A Wheelchair
3099,TRAVEL,Outrageous Hidden Hotel Fees
3100,WELLNESS,Day 4: Trade Your Milk and Butter for Plant-Based Versions
3101,TRAVEL,Why Gran Canaria And The Canary Islands Are Worth A Visit
3102,PARENTING,The Secret Lives of Other Moms
3103,FOOD & DRINK,"5 Tips And Recipes For Healthy\, Juicy Chicken Breasts"
3104,PARENTING,Protect Your Family's Eyes From the Sun With These Helpful Tips!
3105,WELLNESS,Dog Taking Over Your Bed? Training Can Help You Both Sleep Soundly
3106,FOOD & DRINK,Rum Gets Sophisticated
3107,STYLE & BEAUTY,"Jennifer Lopez\, Justin Timberlake And 83 Other Celebs Before They Were Stylish (PHOTOS)"
3108,WELLNESS,Dr. Ann Albright Is Translating Diabetes Research Into Health
3109,TRAVEL,Taking The Plunge: A Scuba Adventure In Belize (PHOTOS)
3110,STYLE & BEAUTY,Andie MacDowell's Style Evolution: From Big Haired Model To Sleek Movie Star (PHOTOS)
3111,STYLE & BEAUTY,The 5 Pinterest Accounts That Are Changing How We See Style
3112,STYLE & BEAUTY,"Rihanna\, Katy Perry And 21 More Worst-Dressed Celebrities Of The Week (PHOTOS)"
3113,STYLE & BEAUTY,"Beyonce\, Gwen Stefani And 14 More Best-Dressed Celebrities Of The Week (PHOTOS)"
3114,TRAVEL,Being A Jetsetter Curator
3115,WEDDINGS,Marriage Study: Research Reveals That Wives Call Husbands More Than Anyone Else
3116,STYLE & BEAUTY,Behind the Scenes With the Trump Family
3117,TRAVEL,Hidden Gems: The World's 10 Best Unsung National Parks
3118,WELLNESS,Consider Isolation Therapy for Type 2 Diabetes: It's Not as Crazy as It Sounds
3119,FOOD & DRINK,Our Best Grilled Sandwich And Panini Recipes
3120,TRAVEL,How A Kiwi Fruit Led To My Biggest Airport Security Snafu
3121,FOOD & DRINK,The Difference Between Ginger Ale And Ginger Beer
3122,STYLE & BEAUTY,"'America's Next Top Model' Fires Nigel Barker\, Jay Manuel & J. Alexander: What's Next? (POLL)"
3123,TRAVEL,"People Really Do Like To Be Beside The Seaside\, Study Says"
3124,WELLNESS,The History of Intoxication
3125,MONEY,Tax Cheats: Here's When You Can Stop Stressing Out
3126,STYLE & BEAUTY,Heidi Klum 1992 Pic Reveals Model's Brown Hair (PHOTO)
3127,STYLE & BEAUTY,"Madonna's Daughter\, Lourdes\, Shares Her Wardrobe With Her Mom (PHOTOS)"
3128,MONEY,Food Fraud: 8 Hoaxes To Look Out For At The Grocery Store
3129,STYLE & BEAUTY,420 Day: Hemp Wear Pieces You Should Be Wearing Today (PHOTOS)
3130,PARENTING,"Whose Fault Is It If Your Child Spends $2\,000 On A 'Free' Online Game?"
3131,PARENTING,'Vegan Is Love': Children's Book By Ruby Roth Causes Controversy
3132,PARENTING,Brandy Day For Prom Queen: Mom Buys Billboard For Daughter's Campaign
3133,PARENTING,Playhouses For The Child In All Of Us
3134,WELLNESS,"TIME 100: Barbara Van Dahlen\, Ron Fouchier And Robert Grant"
3135,STYLE & BEAUTY,Valerie Bertinelli's Style Evolution: From Good Girl To Real Woman (PHOTOS)
3136,WELLNESS,The Finer Points of Manifesting Change
3137,PARENTING,New Procter & Gamble Commercials Label Motherhood The 'Best Job'
3138,FOOD & DRINK,Joe 'Spud' Murphy: The Man Who Gave Potato Chips Flavor
3139,TRAVEL,Traveling In The Footsteps Of Alexander The Great (PHOTOS)
3140,MONEY,"Burt's Bees\, Tom's Of Maine Owned By Fortune 500 Companies"
3141,HOME & LIVING,Craft Of The Day: A Chic iPad Case Made From A Bubble Envelope
3142,PARENTING,Mindful Parenting: The Buck Stops Here
3143,WELLNESS,HuffPost Workouts: Music Makes Me Move
3144,WELLNESS,Letting Go Of Regrets Is Better For Emotionally Healthy Aging: Study
3145,STYLE & BEAUTY,"Summer Hair Trends: 10 Ways To Wear Hats\, Headbands and Flowers (PHOTOS)"
3146,WELLNESS,'World's Largest Shared Acupuncture' Event a Surprisingly Spiritual Experience
3147,WELLNESS,OScan: Smartphone App Could Help With Oral Cancer Diagnoses
3148,STYLE & BEAUTY,Athletic-Inspired Attire: From The Stylelist Network
3149,FOOD & DRINK,A Good Knife Starter Set
3150,DIVORCE,"How I Did\, and Didn't\, Deal with My Ex-Wife's Affair"
3151,HOME & LIVING,"Spring Cleaning: How To Sell\, Swap Or Donate Old\, Unwanted Books"
3152,WEDDINGS,"Earth Day 2012: Reuse\, Recycle\, Resell... Your Diamonds?"
3153,STYLE & BEAUTY,Street Style Looks From Stockholm: From The Stylelist Network
