ID,category,description
7870,WELLNESS,Does Cooking for One Mean Cooking for None?
7871,WELLNESS,How to Work With the Power of Love
7872,WELLNESS,Heart Disease Around The World: By The Numbers
7873,HOME & LIVING,Home Decorating Cures for Cabin Fever
7874,PARENTING,"Danny Parmertor's Parents\, Dina And Bob Parmertor\, Speak Out On 'Today'"
7875,TRAVEL,Restaurant El Diablo Cooks Food With Heat From Volcano (VIDEO)
7876,TRAVEL,United Airlines Set To Move To Single Booking System
7877,STYLE & BEAUTY,Queen Elizabeth II Opens New Somerset House Wing In Wild Hat (PHOTOS)
7878,HOME & LIVING,Black Designers Still Fight For A Seat At The Table--Are They Finding Success?
7879,PARENTING,3 Reasons Why You Should Never Have Kids
7880,HOME & LIVING,A Warm Winter Encourages Early Spring Gardening
7881,DIVORCE,Leap Year Divorce: Is Marrying During A Leap Year Bad Luck?
7882,STYLE & BEAUTY,Galaxy Quest: From Our Network
7883,PARENTING,What Are Some Specific Coping Strategies for Couples Who Are Experiencing the Emotional Pain of Infertility?
7884,STYLE & BEAUTY,Angelina Jolie Shows Some Leg At The Oscars: Can You Guess The Other Stars Who've Done The Same? (QUIZ)
7885,DIVORCE,Should You Reconcile With Your Ex?
7886,HOME & LIVING,Craft Of The Day: Rustic Pencil Holder
7887,PARENTING,Leap Year Celebrity Babies: Pregnant Celebs Who Could Give Birth On Leap Day 2012
7888,WELLNESS,"Rock\, Paper\, Scissors: A Dialogue on Who We Are"
7889,WELLNESS,"Blood Sugar Solution Challenge\, Day 2: Cutting Cravings--Balance Your Blood Sugar"
7890,STYLE & BEAUTY,Twin Peaks Lookbook: From Our Network
7891,STYLE & BEAUTY,Grey And Charlie Chaplin: From Our Network
7892,STYLE & BEAUTY,Milan Fashion Week Fall 2012: Most Outrageous Moments (PHOTOS)
7893,WELLNESS,Cancer Predicted To Kill 1.3 Million European Union Citizens This Year
7894,PARENTING,The Case For Recess
7895,WELLNESS,Looking Back on Valentine's Day
7896,WEDDINGS,Leap Year Proposal: What's The Story Behind It?
7897,TRAVEL,The Iditarod: Mushing With The Best In The World
7898,PARENTING,Ohio School Shooting: Are Parents To Blame?
7899,WELLNESS,"Tim Barter\, British Man\, Has Dented Head Rebuilt With Stomach Fat At King's College Hospital (PHOTOS)"
7900,PARENTING,Going Places
7901,STYLE & BEAUTY,Jennifer Lopez 'V' Cover Shoot Features A Rather Prominent... Bulge (PHOTOS)
7902,TRAVEL,Leap Year: 24-Hour Celebration At Walt Disney World And Disneyland
7903,PARENTING,One More Terrifying Thing Parents Haven't Thought Of
7904,STYLE & BEAUTY,Adriana Lima & Doutzen Kroes 'V' Magazine Shoot Gets Physical (PHOTOS)
7905,WELLNESS,Do Vibrating Platforms Really Work?
7906,PARENTING,Do Kids Who Play Team Sports Eat More Junk Food?
7907,HOME & LIVING,Sprout Home Plant Of The Week: Mikado
7908,TRAVEL,Potentially Deadly Luxury Destinations (PHOTOS)
7909,WEDDINGS,"Manuel Sosa\, Man Battling Liver Disease\, Gets 'Wish Upon A Wedding' Ceremony"
7910,WELLNESS,6 Steps to Change Your Life and Get What You Want
7911,PARENTING,"\Adoption\"" Needs to Become a Buzz Word in the Social Lexicon of America"""
7912,STYLE & BEAUTY,FHM 'Racist' Cover Gets Nixed After Readers Complain (PHOTO)
7913,STYLE & BEAUTY,Banana Republic 'Mad Men' Airplane Show Is Underway (PHOTOS)
7914,FOOD & DRINK,Pudding Recipes Better Than The Store-Bought Variety (PHOTOS)
7915,TRAVEL,Joerg Daiber's Myanmar In Tilt-Shift (VIDEO)
7916,STYLE & BEAUTY,Justin Bieber's Style Evolution (PHOTOS)
7917,WEDDINGS,"Khloe Kardashian\, Lamar Odom Marriage: Khloe Talks 'Sex Den' On 'Jay Leno' (VIDEO)"
7918,WELLNESS,How Exercise Makes You Smarter
7919,WELLNESS,Cancer-Fighting Broccoli: New Study Sheds Light On What Makes The Veggie So Super
7920,WEDDINGS,'Say Yes Katie' Proposal Meme: Len Kendall Asks Internet For Help Proposing (PHOTOS) (UPDATED)
7921,STYLE & BEAUTY,You're Gorgeous: A Skin Regimen for Your Red Life
7922,WEDDINGS,Saving Your Marriage After Financial Hardship
7923,PARENTING,Beyonce's First Time Out With Blue Ivy: Remembering the Newborn-In-Public Jitters
7924,WELLNESS,Sleeping Pills Risks: Study Finds Increased Death Risk From Taking Hypnotics
7925,PARENTING,Worth The Wait: Curbing The Practice Of Deliveries Before 39 Weeks
7926,WELLNESS,Don't Overlook Your Scalp -- Common Scalp Conditions and Treatment Suggestions
7927,PARENTING,A Decade of Enlightenment: Ten Things Parenthood Has Taught Me
7928,WELLNESS,Why Yoga Is So Misunderstood: How it Has Gone From the Sane to the Bizarre
7929,WELLNESS,Being a Veteran Can Be Hazardous to Your Health
7930,TRAVEL,Beyond The National Gallery: Four Out-Of-The-Way London Museums And Where To Eat Nearby
7931,TRAVEL,"Vancouverites Cross Border\, Shopping For Discount Flights"
7932,TRAVEL,Confessions Of An Airport Shuttle Van Driver
7933,WELLNESS,Wisdom for the Road Ahead
7934,TRAVEL,The Resilient Beauty Of Greece (PHOTOS)
7935,FOOD & DRINK,Money-Saving Tip: How To Keep Your Herbs Fresh
7936,WELLNESS,"Jillian Michaels Talks Sleep\, Workout Motivation And Body Confidence"
7937,WELLNESS,Knowing Your Body
7938,WELLNESS,4 Yoga Back Benefits
7939,STYLE & BEAUTY,Hannah Simone's Two Beauty Looks: Which Do You Like Best?
7940,TRAVEL,Disney World Wedding: An African Night In Central Florida (PHOTOS)
7941,TRAVEL,10 Ancient Cities To Visit (PHOTOS)
7942,TRAVEL,Etihad's Next Play: Daily Flights To Dulles
7943,WELLNESS,When Good Grief Goes Bad
7944,DIVORCE,The Secret Divorce Dreams Of Married Women
7945,TRAVEL,Disposing Of Live Bombs In Germany
7946,STYLE & BEAUTY,How To Wear Socks With Heels And Not Look Like A Nerd (PHOTOS)
7947,WELLNESS,Are Your Beliefs Making You Ill?
7948,WELLNESS,CyberKnife? 5 Questions on Prostate Cancer With Dr. Jonathan Haas
7949,WELLNESS,The Many Faces of Fear and How to Deal With Them
7950,FOOD & DRINK,What's In Your Fruit Chew Snacks?
7951,STYLE & BEAUTY,"Cassandra Kellogg\, Stylist & Swimwear Designer\, Shows Off Her Beachy Wardrobe (VIDEO)"
7952,WELLNESS,It's Brutal Honesty Time
7953,FOOD & DRINK,Bang For Your Buck: Bisquick vs. Homemade Pancakes
7954,WELLNESS,Kombucha Tea: Is It Healthy?
7955,WELLNESS,The Happiest (And Unhappiest) States In The U.S.
7956,STYLE & BEAUTY,"Need Supply Co. Has A Small Town Feel\, With Big City Designers (PHOTOS)"
7957,TRAVEL,"A Human-Powered Race Through The Alaskan Wilderness (VIDEO\, PHOTOS)"
7958,FOOD & DRINK,How To Make Authentic Ramen Soup At Home
7959,FOOD & DRINK,"Once And For All\, The Best Way To Cut A Mango"
7960,WELLNESS,School Shootings And PTSD: Trauma Can Last For Months Or Years
7961,STYLE & BEAUTY,"Model Trips On Anthony Vaccarello Fall 2012 Runway\, Is Helped Off By Fellow Models (PHOTOS)"
7962,PARENTING,AAP Breastfeeding Recommendation: Statement Reaffirms Babies Should Be Breastfed For 6 Months
7963,STYLE & BEAUTY,Michelle Obama Fashion Vault 2012: All The First Lady Looks This Year (PHOTOS)
7964,WEDDINGS,Pre-Wedding Blood Tests
7965,STYLE & BEAUTY,"Hannah Elliott\, Writer For Forbes Magazine: From Our Network"
7966,STYLE & BEAUTY,Jbrand & Saks Behind The Scenes Photoshoot: From Our Network
7967,STYLE & BEAUTY,Montreal Fashion Week Designers And Their Collections: From Our Network
7968,WELLNESS,Heart Health Month: 'I Go Red for All of the Women in My Family'
7969,STYLE & BEAUTY,Julia Sarr-Jamois In A Floral Jacket: Look Of The Day (PHOTOS)
7970,HOME & LIVING,"The Fancy\, A New Social Media Website\, Takes On Pinterest"
7971,STYLE & BEAUTY,Givenchy Glittered Chunky-Heel Sandal: Object Of My Affection (PHOTOS)
7972,PARENTING,"Diaper Dash\, Fort Wayne Baby Race\, Awards $1\,000 To Fastest Crawler"
7973,WELLNESS,Allure Of Qnexa: Clamor For Obesity Pill May Test FDA Limits
7974,WEDDINGS,What's Your Wedding Style?
7975,PARENTING,"Addison Cox\, 9-Month-Old With Stage 4 Cancer Passed From Her Mom\, Fights For Her Life"
7976,PARENTING,Leap Year Babies: Expecting On February 29?
7977,STYLE & BEAUTY,"Angelina Jolie 'Vogue Turkey' Cover Is Missing A Right Leg (PHOTOS\, POLL)"
7978,WELLNESS,Coconut Oil: Your New Best Friend
7979,STYLE & BEAUTY,"'The Bachelor' Season 16\, Ep. 9 Style Recap: Let's Get Comfortable (PHOTOS)"
7980,WELLNESS,O'Malley's Lips Sealed on Final Blog: Heart Month -- Day 28
7981,STYLE & BEAUTY,Our Beef With Red-Carpet Fashion: Whatever Happened To Personal Style?
7982,PARENTING,Owner Of 'Human Hamster Ball' Attraction At Maine Mall Wants State To Reconsider Ban (VIDEO)
7983,HOME & LIVING,Tide Detergent Cleans Up Jet Fuel From Juan Montoya's Daytona 500 Car Crash (VIDEO)
7984,WELLNESS,What Doctors Don't Understand About Anesthesia
7985,STYLE & BEAUTY,"Agyness Deyn Admits She's Been Lying About Her Age\, Is Actually 29"
7986,HOME & LIVING,CustomMade Curator: Ammunition Hallway Table
7987,STYLE & BEAUTY,A Black Model in Paris
7988,FOOD & DRINK,Stylish Yellow Kitchen Accessories And Appliances
7989,HOME & LIVING,Napa's Premonition of Spring
7990,FOOD & DRINK,Why Do Bananas Turn Brown In The Fridge?
7991,DIVORCE,Barry Sanders Divorce: NFL Hall Of Famer Files For Divorce
7992,WELLNESS,"Pills Just As Good As Stents For Stable Heart Patients\, Analysis Finds"
7993,STYLE & BEAUTY,Karlie Kloss Paris Fashion Week 2012: Is A Major Moment In Store?
7994,STYLE & BEAUTY,My Day in the Fashion Week of Moda Operandi CEO Aslaug Magnusdottir
7995,WELLNESS,How Apologizing Makes You More Powerful
7996,HOME & LIVING,Weekly Roundup of eBay Vintage Home Finds (PHOTOS)
7997,STYLE & BEAUTY,Online Dating Etiquette
7998,TRAVEL,"Costa Allegra Fire: Jayne Thomas\, Mom\, Talks About Having Her Children On Costa Allegra And Costa Concordia Cruise Ships (VIDEO)"
7999,HOME & LIVING,New Uses For Everyday Things: 5 Ideas For CDs
8000,STYLE & BEAUTY,What My Facebook Friends Asked Gail Simmons
8001,TRAVEL,Shooting Cuba: An Aging Car With New Age Gadgetry (VIDEO)
8002,STYLE & BEAUTY,"The New Carrie Bradshaw\, Prada And Schiaparelli At The Met And More Style News"
8003,TRAVEL,Virgin Atlantic Teaches Flight Attendants How To Whisper For Its Calming Effect
8004,STYLE & BEAUTY,Taylor Swift No Makeup At LAX Airport (PHOTOS)
8005,PARENTING,Why Women Won't Have Sex With Their Husbands
8006,STYLE & BEAUTY,"Half Of Women Are Dependent On Makeup\, Study Says"
8007,WELLNESS,"Blood Sugar Solution Challenge\, Day 1: Eat More\, Weigh Less--Eat Real Food"
8008,PARENTING,Ways My Arab Family Screws With My Head
8009,DIVORCE,Co-parenting Advice: 5 Tips For Success
8010,DIVORCE,New Year Divorce Spike
8011,FOOD & DRINK,How To Cut Fresh Pineapple (And Make The Most Of It)
8012,STYLE & BEAUTY,Kourtney Kardashian: My Life In Outfits (PHOTOS)
8013,WEDDINGS,Weddings 2012: Six Original Party Favours That Will Delight Even The Most Swag-fatigued Guest
8014,DIVORCE,"Lonely\, He's Not: Paul Weitz Recruits Familiar Film Actors To Star In His New Play"
8015,WEDDINGS,5 Tips To Cut Wedding Costs
8016,WEDDINGS,"Steven Tyler\, Erin Brady Engaged: Aerosmith Singer Talks Wedding On 'Jimmy Kimmel' (VIDEO)"
8017,DIVORCE,An Oscar-Themed Open Letter to Demi Moore
8018,WELLNESS,"Diabetes\, Memory Loss Warnings Added To Popular Statin Drugs"
8019,STYLE & BEAUTY,Karlie Kloss Anthony Vaccarello Fall 2012 Show Kicks Off Model's Fashion Week (PHOTOS)
8020,STYLE & BEAUTY,Herve Leger Spring 2012 Ads Features Horses & The Models Who Love Them (PHOTOS)
8021,PARENTING,"So\, Like\, You Want Your Kids To Speak\, Like\, Properly?"
8022,DIVORCE,"Kelsey Grammer\, Camille Grammer Custody Settlement Reached: Report"
8023,STYLE & BEAUTY,Michelle Obama Fashion Vault 2011: All The First Lady Outfits This Year (PHOTOS)
8024,HOME & LIVING,Flower Bud Napkin Rings Made From...Toilet Paper Rolls?
8025,WEDDINGS,Are You In A Drive-Thru Marriage? 4 Financial Signs That Your Marriage Is Over Before It Began
8026,PARENTING,Chicken Curry Lullaby
8027,WELLNESS,Weight Loss Success: Paco Chairez Discovered BodyPump And Zumba And Lost 60 Pounds
8028,PARENTING,Why Teaching Kids Self-Regulation Skills Is Essential
8029,WELLNESS,Who Suffers More: Alzheimer's Patients or Their Caregivers?
8030,PARENTING,"Andrew Zimmern Talks Family\, Bizarre Food And Getting Kids To Eat Adventurously"
8031,DIVORCE,Young Divorcées Battle The Pitter-Patter Of Insomnia
8032,WELLNESS,Why Do Cancer Patients Die From Blood Clots?
8033,TRAVEL,My Swiss Spa Day
8034,WELLNESS,The Mental Spider That Claims to Be Us
8035,WELLNESS,Non-Invasive Tests for Down Syndrome Are Here -- Now What?
8036,STYLE & BEAUTY,Oscars 2012 Worst-Dressed: See Whose Looks Went Awry (PHOTOS)
8037,FOOD & DRINK,Jamie Oliver's Genius Pancake Formula (VIDEO)
8038,STYLE & BEAUTY,Marlene Dietrich's Hollywood Glamour
8039,WELLNESS,Soul-Talk: Are You Courageous or Just Self-Righteous?
8040,WELLNESS,Being an Original in a Copycat World Is Easier Than You Think
8041,WELLNESS,Sleep Stages: What Happens During Sleep?
8042,STYLE & BEAUTY,My Week With Marilyn: Beth Jones' Makeover (PHOTOS)
8043,STYLE & BEAUTY,Loïc Prigent: Fashion Insider Documentaries
8044,STYLE & BEAUTY,Polka Dot Nail Art And More Of Our Manicures This Weekend (PHOTOS)
8045,WELLNESS,"Leap Year Lesson: What Is a Year\, Anyway?"
8046,TRAVEL,Top 5 Mountain Activities For Non Skiers
8047,PARENTING,'Bully' Documentary's R-Rating Causes Parents To Petition MPAA (VIDEO)
8048,WELLNESS,It's Not About the To Do List
8049,STYLE & BEAUTY,"Viola Davis Wears Her Natural Hair At The 2012 Oscars (PHOTO\, POLL)"
8050,STYLE & BEAUTY,Dakota Johnson's Two Beauty Looks: Which Do You Like Best? (POLL)
8051,PARENTING,The Word On The Street
8052,STYLE & BEAUTY,Oscars 2012 Best-Dressed: The Stars Who Made Our Jaws Drop (PHOTOS)
8053,STYLE & BEAUTY,Sporty Surf Style: In The Market For (PHOTOS)
8054,WEDDINGS,15 Signs You're Too Obsessed With The Wedding
8055,FOOD & DRINK,75 Ways To Turn Chicken Into A Great Dinner
8056,TRAVEL,Hungry For Experiences And Hitting The Road
8057,TRAVEL,Leap Year Travel Deals
8058,TRAVEL,Enjoying Brazilian Carnival At A Bloco (PHOTOS)
8059,TRAVEL,"Insane Video Of BASE Jumping In Moab\, Utah (VIDEO)"
8060,WELLNESS,Rosemary Brain Benefit: Study Shows Link Between Herb Chemical And Brainpower
8061,WELLNESS,The Powerful Health Benefits Of Chia Seeds
8062,STYLE & BEAUTY,Vanity Fair Oscar Party 2012: The Better Red Carpet? (PHOTOS)
8063,STYLE & BEAUTY,Naomi Campbell Closes Roberto Cavalli Show In Milan (PHOTOS)
8064,WELLNESS,Omega-3 Skimping May Result In Memory Problems
8065,WELLNESS,Food Safety: 5 Things in Your Kitchen That Could Make You Sick
8066,WELLNESS,What Do You Conform To?
8067,PARENTING,Disney: Now in the Business of Shaming Fat Kids
8068,STYLE & BEAUTY,Oscars 2012: The Best And Worst Hair And Makeup Of The Night
8069,HOME & LIVING,Craft Of The Day: Growth Chart
8070,WELLNESS,Allowing the Time to Heal
8071,STYLE & BEAUTY,The Difference Between A Bowler And A Derby Hat: From Our Network
8072,STYLE & BEAUTY,"Katie Ermilio\, Designer\, Shares Her Favorite Hand-Me-Downs (PHOTOS)"
8073,WELLNESS,Pharmageddon: Can a New Weight Loss Drug Really Save Us?
8074,PARENTING,So Much for Quick Fixes: Active Video Games Don't Make Kids More Active
8075,STYLE & BEAUTY,Stefano Pilati Out At Yves Saint Laurent -- Is Hedi Slimane In?
8076,WELLNESS,Wacky Salt-to-Potassium Ratio Doubles Heart Disease Deaths: Heart Month -- Day 27
8077,PARENTING,Meryl's Humblebrag: A Teachable Moment For Moms
8078,TRAVEL,Are We Better Off Without The TSA?
8079,STYLE & BEAUTY,Princess Charlene Oscars Appearance Actually Happened! (PHOTOS)
8080,STYLE & BEAUTY,Kate And Naomi: From Our Network
8081,STYLE & BEAUTY,"Shailene Woodley Oscar Dress 2012: Was Her White Valentino Too Stuffy? (PHOTOS\, POLL)"
8082,PARENTING,Why Won't My Wife Have Sex With Me?
8083,WELLNESS,Picture Perfect Pets: Submit Your Own! (PHOTOS)
8084,PARENTING,Weaning And Depression Linked In Many Women
8085,WELLNESS,How to Be Happy
8086,STYLE & BEAUTY,Vanity Fair Oscar Party 2012: The Better Red Carpet? (PHOTOS)
8087,HOME & LIVING,"Catching Up With Brad Goreski\, Star Of Bravo's 'It's A Brad\, Brad World'"
8088,STYLE & BEAUTY,Angelina Jolie Right Leg At 2012 Oscars Takes Over The Internet (PHOTOS)
8089,STYLE & BEAUTY,Alessandra Ambrosio Shows Off Baby Bump On Oscars Night (PHOTOS)
8090,WELLNESS,"Prochieve\, Premature Birth Drug\, Rejected By FDA"
8091,HOME & LIVING,Sprout Home: What You Need To Know About Container Gardening
8092,STYLE & BEAUTY,Angelina on the Red Carpet: 7 Sensational Style Strategies That Make Her Shine
8093,FOOD & DRINK,Oversized Ice Cubes: How To Recreate The Bar Trend At Home
8094,TRAVEL,"The Remote\, Lonely Wilds Of Chilean Patagonia (VIDEO\, PHOTOS)"
8095,STYLE & BEAUTY,"Stefano Pilati Leaves YSL\, J.Lo's Non-Wardrobe Malfunction And More Style News"
8096,TRAVEL,Cruise Passengers Robbed: 22 Carnival Passengers Held Up In Mexico
8097,WELLNESS,Can the 'Free Fruit' on the Weight Watchers Plan Satisfy a Carbohydrate Craver?
8098,PARENTING,I'm Pregnant! Where's The Buffet?!
8099,PARENTING,Is There a 'Right Way' to Parent?
8100,WELLNESS,Calling in Crazy: Why We Must Normalize Mental Illness
8101,WELLNESS,Trauma and Adversity in Childhood: History Need Not Be Destiny
8102,WELLNESS,Rooted in Fear
8103,WELLNESS,Can Organic Food Reverse Cancer?
8104,FOOD & DRINK,9 Breakfasts -- For Dinner!
8105,WELLNESS,What's Great About Grapefruit
8106,WELLNESS,Join Me on the 30-Day Blood Sugar Solution Challenge
8107,HOME & LIVING,How To Be Organized: Cleaning Your Sink
8108,PARENTING,How To Get Your Kids Out The Door
8109,STYLE & BEAUTY,Insect-Inspired Fashion: We're Buggin' Out Over These (PHOTOS)
8110,STYLE & BEAUTY,"Oscars 2012 Red Carpet: All The Dresses\, Jewels & More! (PHOTOS)"
8111,TRAVEL,Discovering Denver
8112,STYLE & BEAUTY,Viola Davis Oscars Dress 2012: Green Vera Wang & Natural Hair! (PHOTOS)
8113,STYLE & BEAUTY,"Nikita Ramchandani\, Financial Analyst: FaceTime\, A Beauty Street Style Column"
8114,HOME & LIVING,Finding The Best Sheets For Your Budget: A Buying Guide (PHOTOS)
8115,STYLE & BEAUTY,Gwyneth Paltrow Oscars Dress 2012: Tom Ford White Cape! (PHOTOS)
8116,STYLE & BEAUTY,Jessica Biel Does Casual-Chic: Look Of The Day (PHOTOS)
8117,STYLE & BEAUTY,Jennifer Lopez Oscars Dress 2012: A Little Too Sheer? (PHOTOS)
8118,WEDDINGS,Oscars Dresses: Wedding Dress Inspiration At The 2012 Academy Awards
8119,PARENTING,Babes No More
8120,WELLNESS,Some Patients With LeRoy Mystery Illness Are Getting Better: Reports
8121,STYLE & BEAUTY,Shop the Runway's Looks From Fashion Week
8122,STYLE & BEAUTY,Armani Fall 2012 Show Features Hats... And Flats! (VIDEO)
8123,STYLE & BEAUTY,Joan Smalls Vogue Italia Cover Brings Much-Needed Diversity (PHOTO)
8124,DIVORCE,South Korea's Divorce Numbers Fell To 14-year Low In 2011
8125,WELLNESS,Should I Give Up Me to Not Lose You?
8126,WELLNESS,Omega 3's: 8 Vegetarian Ways To Sneak More Into Your Diet
8127,WELLNESS,Celebrities Who Love Yoga
8128,TRAVEL,Winter Weekend in Budapest: Alone in Great Company
8129,STYLE & BEAUTY,Armani Reveals 'Most Shocking' Part Of Fall Collection (VIDEO)
8130,STYLE & BEAUTY,Helen Mirren Poses At Dolce & Gabbana Fall 2012 Show (PHOTOS)
8131,STYLE & BEAUTY,Raf Simons Cries At Final Jil Sanders Show
8132,STYLE & BEAUTY,"Raf Simons' Final Jil Sander Show Brings Tears\, Standing Ovation (PHOTOS)"
8133,STYLE & BEAUTY,"Victoria Beckham\, Posh Spice\, In 1996"
8134,WELLNESS,Are You Connecting?
8135,FOOD & DRINK,"Oscar Drinks\, Desserts And (Most Importantly) Dresses"
8136,STYLE & BEAUTY,The Sisterhood of the Blow-out -- How LA Prepares for the Oscars
8137,TRAVEL,"Southwest Airlines Pilot's Birthday Wish Causes Bomb Scare When Passengers Hear 'Bomb\,' Not 'Mom' (VIDEO)"
8138,STYLE & BEAUTY,"Oscars 2012 Red Carpet: All The Dresses\, Jewels & More! (PHOTOS)"
8139,STYLE & BEAUTY,The Lead Carpet: Who's Going to Lose?
8140,WELLNESS,Medicare Covers Yoga For Heart Disease
8141,TRAVEL,Racing For Ulaanbaatar
8142,WELLNESS,Why Healthy Eating And Getting Fit Really Are Mental
8143,HOME & LIVING,Sprout Home Inspiration Of The Week: Trees Are For People (PHOTOS)
8144,STYLE & BEAUTY,Jaime King's Preppy Ensemble: Look Of The Day (PHOTOS)
8145,WELLNESS,World Yoga Day 2012: Good For The Community And Good For You
8146,WELLNESS,"Cabernet\, Petit Syrah & Pinot Noir Top Wines for Heart -- Day 26"
8147,HOME & LIVING,Vladimir Kanevsky's Porcelain Flowers In The Wall Street Journal
8148,WELLNESS,Why You Shouldn't Eat Carbs After Exercise
8149,PARENTING,Breastfeeding Inside Disney's Animal Kingdom
8150,TRAVEL,Volcanic Versus Coral: The Caribbean Throw-Down (PHOTOS)
8151,WELLNESS,2012 Oscars: Health Lessons We Can Learn From The Nominees
8152,TRAVEL,Is Jet Set Surgery The New Luxury Travel Trend?
8153,WELLNESS,World Yoga Day: Poses You Never Thought You Could Do (PHOTOS)
8154,STYLE & BEAUTY,Five Fun Ways To Get In On The Gold Nail Polish Trend
8155,WELLNESS,"Flavonoids\, Antioxidants Found In Citrus\, Tied With Lower Stroke Risk: Study"
8156,WELLNESS,Achieving Balance With Ayurveda
8157,COMEDY,When a Heckler Goes Too Far
8158,COMEDY,Comedians Live Tweet The Oscars
8159,COMEDY,Honest Movie Titles: Oscars 2012
8160,COMEDY,Mitt Romney In 'The Artist': Chris Matthews Show Makes Silent Trailer (VIDEO)
8161,COMEDY,The Psychometer: Who Went Too Far This Week? (PICTURE)
8162,COMEDY,Awkward Girl Caught On Camera During News Report (VIDEO)
8163,COMEDY,Presidential Candidates' Oscar Picks (PHOTOS)
8164,CRIME,"In Amish Country\, Accusations Of A Ponzi Scheme"
8165,CRIME,"Utah Teen Allegedly Takes Mom's Car\, Robs Two Banks At Drive-Through Window"
8166,BLACK VOICES,Viola Davis: Filmography (VIDEO)
8167,BLACK VOICES,Vivian Green Opens Up On The Philadelphia Eagles Disappointing Season: Love Of The Game
8168,BLACK VOICES,'Black Love' Wedding Announcements (PHOTOS)
8169,BLACK VOICES,Why Racism Hasn't Died
8170,BLACK VOICES,White House Black Market Spring 2012 'Work Kit' Commerical Starring Coco Rocha (VIDEO)
8171,BLACK VOICES,Viola Davis' Style Evolution (PHOTOS)
8172,BLACK VOICES,"Manouschka Guerrier\, 'Private Chef Of Beverly Hills\,' At Sunday Dinner"
8173,SCIENCE,"Pacific Red Lionfish Blows Jets Of Water To Snare Prey\, Pterois Volitans Study Shows (VIDEO)"
8174,SCIENCE,"Planets Align: Venus\, Jupiter\, Mercury\, Mars & Moon To Appear February 26"
8175,SCIENCE,Rogue Planet 'Nomads' May Outnumber Stars In Milky Way
8176,SCIENCE,"Maya Civilization Collapsed Amidst Mild Drought\, New Study Suggests"
8177,QUEER VOICES,"Know Thine Enemy: The Worst Anti-Gay Moments Of The Week\, February 19 - February 26"
8178,QUEER VOICES,"Fez Whatley\, SiriusXM Radio Host\, Comes Out As Gay On Air On Ron & Fez Show"
8179,IMPACT,Malcolm X: The Paragon of Self-Transformation
8180,IMPACT,"Oscars 2012: Brad Pitt\, George Clooney Most Charitable Oscar Nominees"
8181,ENVIRONMENT,Sustainable Tourism: A Key to Global Solutions
8182,ENVIRONMENT,Animal Photos Of The Week
8183,BUSINESS,Foreclosure Settlement's 'Epic Fail'
8184,BUSINESS,Occupy Louisville Protestors Arrested After Clash With Police At Chase Bank In Kentucky
8185,BUSINESS,Why People Use Money as Instant Gratification
8186,BUSINESS,"Goodyear Recalls 41\,000 Wrangler Silent Armor Tires That Could Tear"
8187,BUSINESS,Michigan Welfare Cuts Forcing People Back To Work Or Straining Safety Net?
8188,BUSINESS,Americans Cut Down On Checking For Colon Cancer During Recession
8189,ENTERTAINMENT,"When Are The Oscars?: 2012 Academy Awards Start Time\, Best Picture Nominees And Fun Facts"
8190,ENTERTAINMENT,"Elizabeth Reaser on Broadway\, Breasts and Playing Opposite the Big Boys -- Brave and True"
8191,ENTERTAINMENT,Academy Awards 2012: Will 'The Artist' Win Big?
8192,ENTERTAINMENT,Oscars Red Carpet: Stars Prepare For 2012 Academy Awards (VIDEO)
8193,ENTERTAINMENT,"Seth Rogen Independent Spirit Awards Monologue: Host Blasts Brett Ratner\, Chris Brown And Mel Gibson In Hilarious Opening"
8194,ENTERTAINMENT,Oscars 2012: Academy Awards Attract Big Stars (LIVE UPDATES)
8195,ENTERTAINMENT,Independent Spirit Awards 2012: Winners List (PHOTOS)
8196,TECH,The Patent Condundrum -- For Startups
8197,TECH,"Face-Recognition Billboard Displays Ads To Women\, Not Men\, For Plan UK Campaign In London (VIDEO\, POLL)"
8198,TECH,HTC One Smartphones Announced At Mobile World Congress
8199,TECH,"Sony Xperia P\, Xperia U Announced At Mobile World Congress"
8200,HOME & LIVING,Double Negative:  Minimal Nature
8201,TRAVEL,Around The World Travel In 5 Easy Steps (PHOTOS)
8202,WELLNESS,Should Women Take Calcium and Vitamin D or Not?
8203,STYLE & BEAUTY,Celebrities In Their Favorite Denim: A Tribute To Levi Strauss (PHOTOS)
8204,WELLNESS,Navigating the Oscar Party: 5 Strategies to Combat Social Pressure in Food Situations
8205,DIVORCE,The Power of Silence
8206,WEDDINGS,Oscar Speeches: Which Academy Award Winners Thanked Their Spouses On Stage?
8207,WELLNESS,Dancing with the Stars Feb. 25th: American Heart Month -- Day 25
8208,TRAVEL,Beauty And Violence Rub Elbows In Salvador Da Bahia (PHOTOS)
8209,TRAVEL,Riding Trans-Siberian Rails Into The Great White (PHOTOS)
8210,WEDDINGS,How To Prevent Your Ex From Crashing Your Wedding
8211,STYLE & BEAUTY,Kathy Ireland Is The Richest Model In The World With $2 Billion Retail Empire (PHOTOS)
8212,STYLE & BEAUTY,Hedi Slimane Replacing Stefano Pilati At YSL? (UPDATED)
8213,WELLNESS,4 Healthy Games To Play With Your Cat
8214,PARENTING,Methotrexate Shortage: What Happens When We Run Out Of A  Key Cancer Drug For Kids?
8215,WELLNESS,Super Soul Sunday: Breathing Space - Light And Form
8216,WELLNESS,Astrology Now: Life and Relationships at a Crossroads? Relax.
8217,WELLNESS,Study: Sleeplessness Causes Our Mental Circuits to Overheat
8218,WELLNESS,First Quadruple Limb Transplant Performed In Turkey (VIDEO)
8219,WELLNESS,How Toxins Make You Fat: 4 Steps to Get Rid of Toxic Weight
8220,STYLE & BEAUTY,"Veteran Oscar Stylist\, Dawn Haynes\, Talks Eddie Murphy's Absence and Offers Oscar 2012 Style Predictions"
